,Title,Sumber,Label,Hasil_Case_Folding,Hasil_Token,Hasil_Stopword,Hasil_Stemming
511,"Jadi Co-Chair COVAX, Menlu Sebut Vaksin Corona Gratis Siap di Kuartal-I 2021",detikHealth,1,jadi cochair covax menlu sebut vaksin corona gratis siap di kuartali,"['jadi', 'cochair', 'covax', 'menlu', 'sebut', 'vaksin', 'corona', 'gratis', 'siap', 'di', 'kuartali']","['jadi', 'cochair', 'covax', 'menlu', 'sebut', 'gratis', 'siap', 'kuartali']","['jadi', 'cochair', 'covax', 'menlu', 'sebut', 'gratis', 'siap', 'kuartal']"
512,dr Tirta Tak Setuju Penerapan Denda untuk Penolak Vaksin Covid-19,detikHealth,1,dr tirta tak setuju penerapan denda untuk penolak vaksin covid,"['dr', 'tirta', 'tak', 'setuju', 'penerapan', 'denda', 'untuk', 'penolak', 'vaksin', 'covid']","['dr', 'tirta', 'tak', 'setuju', 'penerapan', 'denda', 'penolak', '']","['dr', 'tirta', 'tak', 'tuju', 'terap', 'denda', 'tolak', '']"
513,"Tak Ragu Disuntik Vaksin Sinovac, dr Tirta: Sudah Terjamin Uji Klinis",detikHealth,1,tak ragu disuntik vaksin sinovac dr tirta sudah terjamin uji klinis,"['tak', 'ragu', 'disuntik', 'vaksin', 'sinovac', 'dr', 'tirta', 'sudah', 'terjamin', 'uji', 'klinis']","['tak', 'ragu', 'disuntik', 'sinovac', 'dr', 'tirta', 'terjamin', 'uji', 'klinis']","['tak', 'ragu', 'suntik', 'sinovac', 'dr', 'tirta', 'jamin', 'uji', 'klinis']"
514,"Bukan di Istana, Ini Alasan dr Tirta Pilih Vaksin COVID-19 di Puskesmas",detikHealth,0,bukan di istana ini alasan dr tirta pilih vaksin covid di puskesmas,"['bukan', 'di', 'istana', 'ini', 'alasan', 'dr', 'tirta', 'pilih', 'vaksin', 'covid', 'di', 'puskesmas']","['bukan', 'istana', 'alasan', 'dr', 'tirta', 'pilih', 'puskesmas']","['bukan', 'istana', 'alas', 'dr', 'tirta', 'pilih', 'puskesmas']"
515,Wamenkes Tegaskan Vaksinasi COVID-19 Gratis,detikHealth,1,wamenkes tegaskan vaksinasi covid gratis,"['wamenkes', 'tegaskan', 'vaksinasi', 'covid', 'gratis']","['wamenkes', 'tegaskan', 'gratis']","['wamenkes', 'tegas', 'gratis']"
516,"Cerita Nakes di Bandung, Langsung Kerja Lagi Usai Vaksin COVID-19",detikHealth,1,cerita nakes di bandung langsung kerja lagi usai vaksin covid,"['cerita', 'nakes', 'di', 'bandung', 'langsung', 'kerja', 'lagi', 'usai', 'vaksin', 'covid']","['cerita', 'nakes', 'bandung', 'langsung', 'kerja', 'usai', '']","['cerita', 'nakes', 'bandung', 'langsung', 'kerja', 'usai', '']"
517,Daftar Lengkap yang Tidak Boleh Disuntik Vaksin Corona,detikHealth,0,daftar lengkap yang tidak boleh disuntik vaksin corona,"['daftar', 'lengkap', 'yang', 'tidak', 'boleh', 'disuntik', 'vaksin', 'corona']","['daftar', 'lengkap', 'disuntik', '']","['daftar', 'lengkap', 'suntik', '']"
518,Dinkes Jateng Terima 2 Laporan Pegal-Nggeliyer Usai Vaksinasi COVID-19,detikHealth,-1,dinkes jateng terima laporan pegalnggeliyer usai vaksinasi covid,"['dinkes', 'jateng', 'terima', 'laporan', 'pegalnggeliyer', 'usai', 'vaksinasi', 'covid']","['dinkes', 'jateng', 'terima', 'laporan', 'pegalnggeliyer', 'usai', '']","['dinkes', 'jateng', 'terima', 'lapor', 'pegalnggeliyer', 'usai', '']"
519,"Usai Vaksinasi COVID-19, Wamenkes: Tidak Ada Rasa Apa-apa",detikHealth,1,usai vaksinasi covid wamenkes tidak ada rasa apaapa,"['usai', 'vaksinasi', 'covid', 'wamenkes', 'tidak', 'ada', 'rasa', 'apaapa']","['usai', 'wamenkes', 'rasa', 'apaapa']","['usai', 'wamenkes', 'rasa', 'apaapa']"
520,"dr Tirta Tak Setuju Penolak Vaksin Dijatuhi Sanksi, Mending Diedukasi",detikHealth,0,dr tirta tak setuju penolak vaksin dijatuhi sanksi mending diedukasi,"['dr', 'tirta', 'tak', 'setuju', 'penolak', 'vaksin', 'dijatuhi', 'sanksi', 'mending', 'diedukasi']","['dr', 'tirta', 'tak', 'setuju', 'penolak', 'dijatuhi', 'sanksi', 'mending', 'diedukasi']","['dr', 'tirta', 'tak', 'tuju', 'tolak', 'jatuh', 'sanksi', 'mending', 'edukasi']"
521,Wamenkes Jelaskan Alasan Pasien COVID-19 Tak Dapat Jatah Vaksin,detikHealth,0,wamenkes jelaskan alasan pasien covid tak dapat jatah vaksin,"['wamenkes', 'jelaskan', 'alasan', 'pasien', 'covid', 'tak', 'dapat', 'jatah', 'vaksin']","['wamenkes', 'jelaskan', 'alasan', 'pasien', 'tak', 'jatah', '']","['wamenkes', 'jelas', 'alas', 'pasien', 'tak', 'jatah', '']"
522,"18 Tahun ke Atas Jadi Prioritas, Ini Batas Usia Vaksin COVID-19",detikHealth,0,tahun ke atas jadi prioritas ini batas usia vaksin covid,"['tahun', 'ke', 'atas', 'jadi', 'prioritas', 'ini', 'batas', 'usia', 'vaksin', 'covid']","['tahun', 'atas', 'jadi', 'prioritas', 'batas', 'usia', '']","['tahun', 'atas', 'jadi', 'prioritas', 'batas', 'usia', '']"
523,Momen Wamenkes Disuntik Vaksin COVID-19 Bersama Para Nakes,detikHealth,0,momen wamenkes disuntik vaksin covid bersama para nakes,"['momen', 'wamenkes', 'disuntik', 'vaksin', 'covid', 'bersama', 'para', 'nakes']","['momen', 'wamenkes', 'disuntik', 'bersama', 'nakes']","['momen', 'wamenkes', 'suntik', 'sama', 'nakes']"
524,"Kemenkes: Kena Efek Samping Vaksin COVID-19, Biaya Ditanggung Pemerintah!",detikHealth,1,kemenkes kena efek samping vaksin covid biaya ditanggung pemerintah,"['kemenkes', 'kena', 'efek', 'samping', 'vaksin', 'covid', 'biaya', 'ditanggung', 'pemerintah']","['kemenkes', 'kena', 'efek', 'samping', 'biaya', 'ditanggung', 'pemerintah']","['kemenkes', 'kena', 'efek', 'samping', 'biaya', 'tanggung', 'perintah']"
525,Wamenkes Minta Masyarakat Tetap Patuhi 4M Meski Sudah Divaksin,detikHealth,0,wamenkes minta masyarakat tetap patuhi  meski sudah divaksin,"['wamenkes', 'minta', 'masyarakat', 'tetap', 'patuhi', 'meski', 'sudah', 'divaksin']","['wamenkes', 'minta', 'masyarakat', 'tetap', 'patuhi', 'meski', '']","['wamenkes', 'minta', 'masyarakat', 'tetap', 'patuh', 'meski', '']"
526,"Drama Vaksin COVID-19, Profesor-Perawat Sama-sama Grogi Suntik Presiden",detikHealth,0,drama vaksin covid profesorperawat samasama grogi suntik presiden,"['drama', 'vaksin', 'covid', 'profesorperawat', 'samasama', 'grogi', 'suntik', 'presiden']","['drama', 'profesorperawat', 'samasama', 'grogi', 'suntik', 'presiden']","['drama', 'profesorperawat', 'samasama', 'grogi', 'suntik', 'presiden']"
527,4 Negara Pemakai Vaksin Sinovac Buatan China,detikHealth,0,negara pemakai vaksin sinovac buatan china,"['negara', 'pemakai', 'vaksin', 'sinovac', 'buatan', 'china']","['negara', 'pemakai', 'sinovac', 'buatan', 'china']","['negara', 'pakai', 'sinovac', 'buat', 'china']"
528,"Disuntik di Abu Dhabi, WNI Ungkap Efek Samping Vaksin COVID-19",detikHealth,-1,disuntik di abu dhabi wni ungkap efek samping vaksin covid,"['disuntik', 'di', 'abu', 'dhabi', 'wni', 'ungkap', 'efek', 'samping', 'vaksin', 'covid']","['disuntik', 'abu', 'dhabi', 'wni', 'ungkap', 'efek', 'samping', '']","['suntik', 'abu', 'dhabi', 'wni', 'ungkap', 'efek', 'samping', '']"
529,Alasan Sleman Pilih dr Tirta Jadi Penerima Vaksin COVID-19 Pertama,detikHealth,0,alasan sleman pilih dr tirta jadi penerima vaksin covid pertama,"['alasan', 'sleman', 'pilih', 'dr', 'tirta', 'jadi', 'penerima', 'vaksin', 'covid', 'pertama']","['alasan', 'sleman', 'pilih', 'dr', 'tirta', 'jadi', 'penerima', 'pertama']","['alas', 'sleman', 'pilih', 'dr', 'tirta', 'jadi', 'terima', 'pertama']"
530,Ayat Alquran tentang Wabah Penyakit dan Cara Menghadapinya,detikHealth,0,ayat alquran tentang wabah penyakit dan cara menghadapinya,"['ayat', 'alquran', 'tentang', 'wabah', 'penyakit', 'dan', 'cara', 'menghadapinya']","['ayat', 'alquran', 'wabah', 'penyakit', 'cara', 'menghadapinya']","['ayat', 'alquran', 'wabah', 'sakit', 'cara', 'hadap']"
531,Menkes Budi Mengaku Tambah Ngantuk Usai Divaksin,detikHealth,-1,menkes budi mengaku tambah ngantuk usai divaksin,"['menkes', 'budi', 'mengaku', 'tambah', 'ngantuk', 'usai', 'divaksin']","['menkes', 'budi', 'mengaku', 'tambah', 'ngantuk', 'usai', '']","['menkes', 'budi', 'aku', 'tambah', 'ngantuk', 'usai', '']"
532,"5 Kepala Negara yang Sudah Divaksin Corona Selain Jokowi, Raja Salman Termasuk",detikHealth,0,kepala negara yang sudah divaksin corona selain jokowi raja salman termasuk,"['kepala', 'negara', 'yang', 'sudah', 'divaksin', 'corona', 'selain', 'jokowi', 'raja', 'salman', 'termasuk']","['kepala', 'negara', 'jokowi', 'raja', 'salman', 'termasuk']","['kepala', 'negara', 'jokowi', 'raja', 'salman', 'masuk']"
533,"Menlu Retno Jadi Co Chair COVAX, Indonesia Ikut Pimpin Gabungan Vaksin COVID-19",detikHealth,0,menlu retno jadi co chair covax indonesia ikut pimpin gabungan vaksin covid,"['menlu', 'retno', 'jadi', 'co', 'chair', 'covax', 'indonesia', 'ikut', 'pimpin', 'gabungan', 'vaksin', 'covid']","['menlu', 'retno', 'jadi', 'co', 'chair', 'covax', 'indonesia', 'ikut', 'pimpin', 'gabungan', '']","['menlu', 'retno', 'jadi', 'co', 'chair', 'covax', 'indonesia', 'ikut', 'pimpin', 'gabung', '']"
534,"Tak Cuma Jokowi, Ini Daftar Penerima Vaksin Pertama",detikHealth,0,tak cuma jokowi ini daftar penerima vaksin pertama,"['tak', 'cuma', 'jokowi', 'ini', 'daftar', 'penerima', 'vaksin', 'pertama']","['tak', 'cuma', 'jokowi', 'daftar', 'penerima', 'pertama']","['tak', 'cuma', 'jokowi', 'daftar', 'terima', 'pertama']"
535,Ketua IDI: Vaksinasi Kurangi Angka Gugurnya Dokter dan Nakes,detikHealth,1,ketua idi vaksinasi kurangi angka gugurnya dokter dan nakes,"['ketua', 'idi', 'vaksinasi', 'kurangi', 'angka', 'gugurnya', 'dokter', 'dan', 'nakes']","['ketua', 'idi', 'kurangi', 'angka', 'gugurnya', 'dokter', 'nakes']","['ketua', 'idi', 'kurang', 'angka', 'gugur', 'dokter', 'nakes']"
536,"Penyuntikan Sudah Dimulai, Ini Deretan Efek Samping Vaksin COVID-19",detikHealth,-1,penyuntikan sudah dimulai ini deretan efek samping vaksin covid,"['penyuntikan', 'sudah', 'dimulai', 'ini', 'deretan', 'efek', 'samping', 'vaksin', 'covid']","['penyuntikan', 'dimulai', 'deretan', 'efek', 'samping', '']","['sunti', 'mulai', 'deret', 'efek', 'samping', '']"
537,"Tak Ikut Suntik di Istana, dr Tirta Divaksin di Sleman 14 Januari",detikHealth,0,tak ikut suntik di istana dr tirta divaksin di sleman januari,"['tak', 'ikut', 'suntik', 'di', 'istana', 'dr', 'tirta', 'divaksin', 'di', 'sleman', 'januari']","['tak', 'ikut', 'suntik', 'istana', 'dr', 'tirta', 'sleman', 'januari']","['tak', 'ikut', 'suntik', 'istana', 'dr', 'tirta', 'sleman', 'januari']"
538,"Bukan Vitamin, Ini Lho Vaksin COVID-19 yang Diterima Jokowi Hari Ini",detikHealth,0,bukan vitamin ini lho vaksin covid yang diterima jokowi hari ini,"['bukan', 'vitamin', 'ini', 'lho', 'vaksin', 'covid', 'yang', 'diterima', 'jokowi', 'hari', 'ini']","['bukan', 'vitamin', 'lho', 'diterima', 'jokowi', 'hari', '']","['bukan', 'vitamin', 'lho', 'terima', 'jokowi', 'hari', '']"
539,"Ditanya Gejala Sebelum Vaksin, Jokowi: Batuk Kecil Saja",detikHealth,1,ditanya gejala sebelum vaksin jokowi batuk kecil saja,"['ditanya', 'gejala', 'sebelum', 'vaksin', 'jokowi', 'batuk', 'kecil', 'saja']","['ditanya', 'gejala', 'jokowi', 'batuk', 'kecil', '']","['tanya', 'gejala', 'jokowi', 'batuk', 'kecil', '']"
540,"Profil Abdul Muthalib, Dokter Kepresidenan yang Memvaksin Jokowi",detikHealth,0,profil abdul muthalib dokter kepresidenan yang memvaksin jokowi,"['profil', 'abdul', 'muthalib', 'dokter', 'kepresidenan', 'yang', 'memvaksin', 'jokowi']","['profil', 'abdul', 'muthalib', 'dokter', 'kepresidenan', 'memvaksin', 'jokowi']","['profil', 'abdul', 'muthalib', 'dokter', 'presiden', 'vaksin', 'jokowi']"
541,"Terima Vaksin Perdana di Istana, Kepala BPOM Disuntik di Ruangan Khusus",detikHealth,0,terima vaksin perdana di istana kepala bpom disuntik di ruangan khusus,"['terima', 'vaksin', 'perdana', 'di', 'istana', 'kepala', 'bpom', 'disuntik', 'di', 'ruangan', 'khusus']","['terima', 'perdana', 'istana', 'kepala', 'bpom', 'disuntik', 'ruangan', 'khusus']","['terima', 'perdana', 'istana', 'kepala', 'bpom', 'suntik', 'ruang', 'khusus']"
542,Momen Dokter Kepresidenan Gemetar Saat Menyuntik Jokowi,detikHealth,0,momen dokter kepresidenan gemetar saat menyuntik jokowi,"['momen', 'dokter', 'kepresidenan', 'gemetar', 'saat', 'menyuntik', 'jokowi']","['momen', 'dokter', 'kepresidenan', 'gemetar', 'menyuntik', 'jokowi']","['momen', 'dokter', 'presiden', 'gemetar', 'suntik', 'jokowi']"
543,Komentar Jokowi Usai Terima Vaksin COVID-19: Nggak Terasa Sama Sekali,detikHealth,1,komentar jokowi usai terima vaksin covid nggak terasa sama sekali,"['komentar', 'jokowi', 'usai', 'terima', 'vaksin', 'covid', 'nggak', 'terasa', 'sama', 'sekali']","['komentar', 'jokowi', 'usai', 'terima', 'terasa', 'sama', 'sekali']","['komentar', 'jokowi', 'usai', 'terima', 'asa', 'sama', 'sekali']"
544,"Vaksinasi COVID-19 Indonesia Dimulai Hari Ini, Menkes Juga Disuntik",detikHealth,0,vaksinasi covid indonesia dimulai hari ini menkes juga disuntik,"['vaksinasi', 'covid', 'indonesia', 'dimulai', 'hari', 'ini', 'menkes', 'juga', 'disuntik']","['', 'indonesia', 'dimulai', 'hari', 'menkes', 'disuntik']","['', 'indonesia', 'mulai', 'hari', 'menkes', 'suntik']"
545,"Vaksinasi Mulai Hari Ini, Catat 2 Cara Pengecekan Penerima Vaksin Corona",detikHealth,0,vaksinasi mulai hari ini catat cara pengecekan penerima vaksin corona,"['vaksinasi', 'mulai', 'hari', 'ini', 'catat', 'cara', 'pengecekan', 'penerima', 'vaksin', 'corona']","['', 'mulai', 'hari', 'catat', 'cara', 'pengecekan', 'penerima', '']","['', 'mulai', 'hari', 'catat', 'cara', 'kece', 'terima', '']"
546,Satgas: Vaksin Diprioritaskan Bagi Warga yang Belum Terpapar Corona,detikHealth,0,satgas vaksin diprioritaskan bagi warga yang belum terpapar corona,"['satgas', 'vaksin', 'diprioritaskan', 'bagi', 'warga', 'yang', 'belum', 'terpapar', 'corona']","['satgas', 'diprioritaskan', 'warga', 'terpapar', '']","['satgas', 'prioritas', 'warga', 'papar', '']"
547,"Dikawal Ketat, 15 Juta 'Bulk' Vaksin Sinovac Tiba di Bandung",detikHealth,0,dikawal ketat juta bulk vaksin sinovac tiba di bandung,"['dikawal', 'ketat', 'juta', 'bulk', 'vaksin', 'sinovac', 'tiba', 'di', 'bandung']","['dikawal', 'ketat', 'juta', 'bulk', 'sinovac', 'tiba', 'bandung']","['kawal', 'ketat', 'juta', 'bulk', 'sinovac', 'tiba', 'bandung']"
548,Bio Farma Sebut Pfizer Ogah Dituntut Bila Vaksin Corona Buatannya Bermasalah,detikHealth,-1,bio farma sebut pfizer ogah dituntut bila vaksin corona buatannya bermasalah,"['bio', 'farma', 'sebut', 'pfizer', 'ogah', 'dituntut', 'bila', 'vaksin', 'corona', 'buatannya', 'bermasalah']","['bio', 'farma', 'sebut', 'pfizer', 'ogah', 'dituntut', 'bila', 'buatannya', 'bermasalah']","['bio', 'farma', 'sebut', 'pfizer', 'ogah', 'tuntut', 'bila', 'buat', 'masalah']"
549,Komentar Pakar UGM soal MUI Tetapkan Vaksin Corona Sinovac Halal,detikHealth,1,komentar pakar ugm soal mui tetapkan vaksin corona sinovac halal,"['komentar', 'pakar', 'ugm', 'soal', 'mui', 'tetapkan', 'vaksin', 'corona', 'sinovac', 'halal']","['komentar', 'pakar', 'ugm', 'soal', 'mui', 'tetapkan', 'sinovac', 'halal']","['komentar', 'pakar', 'ugm', 'soal', 'mui', 'tetap', 'sinovac', 'halal']"
550,Thailand Siap-siap Vaksinasi COVID-19 Pakai Sinovac,detikHealth,0,thailand siapsiap vaksinasi covid pakai sinovac,"['thailand', 'siapsiap', 'vaksinasi', 'covid', 'pakai', 'sinovac']","['thailand', 'siapsiap', 'pakai', 'sinovac']","['thailand', 'siapsiap', 'pakai', 'sinovac']"
551,"14 Provinsi Jadi Prioritas Penerima Vaksin COVID-19, Ini Daftarnya",detikHealth,0,provinsi jadi prioritas penerima vaksin covid ini daftarnya,"['provinsi', 'jadi', 'prioritas', 'penerima', 'vaksin', 'covid', 'ini', 'daftarnya']","['provinsi', 'jadi', 'prioritas', 'penerima', 'daftarnya']","['provinsi', 'jadi', 'prioritas', 'terima', 'daftar']"
552,"Menkes: Lansia Divaksin COVID-19 Maret-April, Umum Akhir April",detikHealth,0,menkes lansia divaksin covid maretapril umum akhir april,"['menkes', 'lansia', 'divaksin', 'covid', 'maretapril', 'umum', 'akhir', 'april']","['menkes', 'lansia', 'maretapril', 'umum', 'akhir', 'april']","['menkes', 'lansia', 'maretapril', 'umum', 'akhir', 'april']"
553,"Efikasi 94 Persen, Vaksin Corona Moderna Diklaim Bikin Kebal COVID-19 Setahun",detikHealth,1,efikasi persen vaksin corona moderna diklaim bikin kebal covid setahun,"['efikasi', 'persen', 'vaksin', 'corona', 'moderna', 'diklaim', 'bikin', 'kebal', 'covid', 'setahun']","['efikasi', 'persen', 'moderna', 'diklaim', 'bikin', 'kebal', 'setahun']","['efikasi', 'persen', 'moderna', 'klaim', 'bikin', 'kebal', 'tahun']"
554,Tips agar Lancar Jalani Vaksinasi COVID-19,detikHealth,0,tips agar lancar jalani vaksinasi covid,"['tips', 'agar', 'lancar', 'jalani', 'vaksinasi', 'covid']","['tips', 'lancar', 'jalani', '']","['tips', 'lancar', 'jalan', '']"
555,"EUA Terbit, Ini Jadwal dan Penerima Vaksin COVID-19 di Indonesia",detikHealth,0,eua terbit ini jadwal dan penerima vaksin covid di indonesia,"['eua', 'terbit', 'ini', 'jadwal', 'dan', 'penerima', 'vaksin', 'covid', 'di', 'indonesia']","['eua', 'terbit', 'jadwal', 'penerima', 'indonesia']","['eua', 'terbit', 'jadwal', 'terima', 'indonesia']"
556,"Perlu Tahu, Ini 4 Tahap Penyuntikan Vaksin COVID-19",detikHealth,0,perlu tahu ini tahap penyuntikan vaksin covid,"['perlu', 'tahu', 'ini', 'tahap', 'penyuntikan', 'vaksin', 'covid']","['perlu', 'tahu', 'tahap', 'penyuntikan', '']","['perlu', 'tahu', 'tahap', 'sunti', '']"
557,Yang Tak Boleh Divaksinasi Corona Berdasarkan SK Dirjen P2P Kemenkes,detikHealth,0,yang tak boleh divaksinasi corona berdasarkan sk dirjen pp kemenkes,"['yang', 'tak', 'boleh', 'divaksinasi', 'corona', 'berdasarkan', 'sk', 'dirjen', 'pp', 'kemenkes']","['', 'tak', 'berdasarkan', 'sk', 'dirjen', 'pp', 'kemenkes']","['', 'tak', 'dasar', 'sk', 'dirjen', 'pp', 'kemenkes']"
558,"Sinovac Dapat EUA BPOM, IDI: Hentikan Polemik dan Dukung Vaksinasi",detikHealth,1,sinovac dapat eua bpom idi hentikan polemik dan dukung vaksinasi,"['sinovac', 'dapat', 'eua', 'bpom', 'idi', 'hentikan', 'polemik', 'dan', 'dukung', 'vaksinasi']","['sinovac', 'eua', 'bpom', 'idi', 'hentikan', 'polemik', 'dukung', '']","['sinovac', 'eua', 'bpom', 'idi', 'henti', 'polemik', 'dukung', '']"
559,"BPOM Sebut Efikasi Vaksin Sinovac 65,3 Persen, Ini Artinya",detikHealth,0,bpom sebut efikasi vaksin sinovac persen ini artinya,"['bpom', 'sebut', 'efikasi', 'vaksin', 'sinovac', 'persen', 'ini', 'artinya']","['bpom', 'sebut', 'efikasi', 'sinovac', 'persen', 'artinya']","['bpom', 'sebut', 'efikasi', 'sinovac', 'persen', 'arti']"
560,"Efikasi 65,3 Persen Masih Data Interim, Vaksin Sinovac Tetap Akan Dipantau",detikHealth,0,efikasi persen masih data interim vaksin sinovac tetap akan dipantau,"['efikasi', 'persen', 'masih', 'data', 'interim', 'vaksin', 'sinovac', 'tetap', 'akan', 'dipantau']","['efikasi', 'persen', 'data', 'interim', 'sinovac', 'tetap', 'dipantau']","['efikasi', 'persen', 'data', 'interim', 'sinovac', 'tetap', 'pantau']"
561,"Vaksin COVID-19 Kantongi Izin dan Fatwa Halal, IDI: Hentikan Polemik!",detikHealth,1,vaksin covid kantongi izin dan fatwa halal idi hentikan polemik,"['vaksin', 'covid', 'kantongi', 'izin', 'dan', 'fatwa', 'halal', 'idi', 'hentikan', 'polemik']","['', 'kantongi', 'izin', 'fatwa', 'halal', 'idi', 'hentikan', 'polemik']","['', 'kantong', 'izin', 'fatwa', 'halal', 'idi', 'henti', 'polemik']"
562,"BPOM: Efikasi Vaksin Sinovac 65,3% dan Efek Samping Ringan-Sedang",detikHealth,-1,bpom efikasi vaksin sinovac dan efek samping ringansedang,"['bpom', 'efikasi', 'vaksin', 'sinovac', 'dan', 'efek', 'samping', 'ringansedang']","['bpom', 'efikasi', 'sinovac', 'efek', 'samping', 'ringansedang']","['bpom', 'efikasi', 'sinovac', 'efek', 'samping', 'ringansedang']"
563,BPOM Jelaskan Efek Samping Vaksin Sinovac yang Sudah Kantongi Izin EUA,detikHealth,0,bpom jelaskan efek samping vaksin sinovac yang sudah kantongi izin eua,"['bpom', 'jelaskan', 'efek', 'samping', 'vaksin', 'sinovac', 'yang', 'sudah', 'kantongi', 'izin', 'eua']","['bpom', 'jelaskan', 'efek', 'samping', 'sinovac', 'kantongi', 'izin', 'eua']","['bpom', 'jelas', 'efek', 'samping', 'sinovac', 'kantong', 'izin', 'eua']"
564,"Efikasi Vaksin COVID-19 Sinovac 65,3 Persen, BPOM: Sesuai Standar WHO",detikHealth,1,efikasi vaksin covid sinovac persen bpom sesuai standar who,"['efikasi', 'vaksin', 'covid', 'sinovac', 'persen', 'bpom', 'sesuai', 'standar', 'who']","['efikasi', 'sinovac', 'persen', 'bpom', 'sesuai', 'standar', 'who']","['efikasi', 'sinovac', 'persen', 'bpom', 'sesuai', 'standar', 'who']"
565,"Sah! BPOM Beri Izin Vaksin COVID-19 Sinovac, Eficacy 65,3 Persen",detikHealth,1,sah bpom beri izin vaksin covid sinovac eficacy persen,"['sah', 'bpom', 'beri', 'izin', 'vaksin', 'covid', 'sinovac', 'eficacy', 'persen']","['sah', 'bpom', 'beri', 'izin', 'sinovac', 'eficacy', 'persen']","['sah', 'bpom', 'beri', 'izin', 'sinovac', 'eficacy', 'persen']"
566,Menkes: Vaksin dari GAVI-COVAX untuk Kelompok Usia di Atas 60 Tahun,detikHealth,0,menkes vaksin dari gavicovax untuk kelompok usia di atas tahun,"['menkes', 'vaksin', 'dari', 'gavicovax', 'untuk', 'kelompok', 'usia', 'di', 'atas', 'tahun']","['menkes', 'gavicovax', 'kelompok', 'usia', 'atas', 'tahun']","['menkes', 'gavicovax', 'kelompok', 'usia', 'atas', 'tahun']"
567,"Ingatkan Keadilan, WHO Ingin Negara Kaya Setop Memborong Vaksin COVID-19",detikHealth,0,ingatkan keadilan who ingin negara kaya setop memborong vaksin covid,"['ingatkan', 'keadilan', 'who', 'ingin', 'negara', 'kaya', 'setop', 'memborong', 'vaksin', 'covid']","['ingatkan', 'keadilan', 'who', 'negara', 'kaya', 'setop', 'memborong', '']","['ingat', 'adil', 'who', 'negara', 'kaya', 'setop', 'borong', '']"
568,Raja Salman Divaksin COVID-19 Buatan Pfizer-BioNTech,detikHealth,0,raja salman divaksin covid buatan pfizerbiontech,"['raja', 'salman', 'divaksin', 'covid', 'buatan', 'pfizerbiontech']","['raja', 'salman', 'buatan', 'pfizerbiontech']","['raja', 'salman', 'buat', 'pfizerbiontech']"
569,Ini Daftar Vaksin Corona yang Dibeli Indonesia,detikHealth,0,ini daftar vaksin corona yang dibeli indonesia,"['ini', 'daftar', 'vaksin', 'corona', 'yang', 'dibeli', 'indonesia']","['', 'daftar', 'dibeli', 'indonesia']","['', 'daftar', 'beli', 'indonesia']"
570,"Tak Langsung Kebal, Butuh Waktu Bangun Antibodi Setelah Suntik Vaksin COVID-19",detikHealth,0,tak langsung kebal butuh waktu bangun antibodi setelah suntik vaksin covid,"['tak', 'langsung', 'kebal', 'butuh', 'waktu', 'bangun', 'antibodi', 'setelah', 'suntik', 'vaksin', 'covid']","['tak', 'langsung', 'kebal', 'butuh', 'waktu', 'bangun', 'antibodi', 'suntik', '']","['tak', 'langsung', 'kebal', 'butuh', 'waktu', 'bangun', 'antibodi', 'suntik', '']"
571,Melihat Alur Pelayanan Vaksinasi Covid-19 di RI,detikHealth,0,melihat alur pelayanan vaksinasi covid di ri,"['melihat', 'alur', 'pelayanan', 'vaksinasi', 'covid', 'di', 'ri']","['melihat', 'alur', 'pelayanan', 'ri']","['lihat', 'alur', 'layan', 'ri']"
572,Sudah Divaksin Bukan Berarti Tak Bisa Terinfeksi COVID-19,detikHealth,-1,sudah divaksin bukan berarti tak bisa terinfeksi covid,"['sudah', 'divaksin', 'bukan', 'berarti', 'tak', 'bisa', 'terinfeksi', 'covid']","['', 'bukan', 'berarti', 'tak', 'terinfeksi', '']","['', 'bukan', 'arti', 'tak', 'infeksi', '']"
573,Terpopuler Sepekan: Ingat! Jangan Langsung Pulang Usai Disuntik Vaksin Corona,detikHealth,0,terpopuler sepekan ingat jangan langsung pulang usai disuntik vaksin corona,"['terpopuler', 'sepekan', 'ingat', 'jangan', 'langsung', 'pulang', 'usai', 'disuntik', 'vaksin', 'corona']","['terpopuler', 'sepekan', 'ingat', 'jangan', 'langsung', 'pulang', 'usai', 'disuntik', '']","['populer', 'pek', 'ingat', 'jangan', 'langsung', 'pulang', 'usai', 'suntik', '']"
574,Menkes Singgung Kepercayaan Vaksin Corona di Masyarakat,detikHealth,0,menkes singgung kepercayaan vaksin corona di masyarakat,"['menkes', 'singgung', 'kepercayaan', 'vaksin', 'corona', 'di', 'masyarakat']","['menkes', 'singgung', 'kepercayaan', 'masyarakat']","['menkes', 'singgung', 'percaya', 'masyarakat']"
575,Menkes Tak Desak BPOM untuk Segera Keluarkan EUA Vaksin Corona Sinovac,detikHealth,0,menkes tak desak bpom untuk segera keluarkan eua vaksin corona sinovac,"['menkes', 'tak', 'desak', 'bpom', 'untuk', 'segera', 'keluarkan', 'eua', 'vaksin', 'corona', 'sinovac']","['menkes', 'tak', 'desak', 'bpom', 'segera', 'keluarkan', 'eua', 'sinovac']","['menkes', 'tak', 'desak', 'bpom', 'segera', 'keluar', 'eua', 'sinovac']"
576,"Pasien Jantung Tak Disarankan Suntik Vaksin COVID-19, Ini Alasannya",detikHealth,0,pasien jantung tak disarankan suntik vaksin covid ini alasannya,"['pasien', 'jantung', 'tak', 'disarankan', 'suntik', 'vaksin', 'covid', 'ini', 'alasannya']","['pasien', 'jantung', 'tak', 'disarankan', 'suntik', 'alasannya']","['pasien', 'jantung', 'tak', 'saran', 'suntik', 'alas']"
577,Jadwal Vaksinasi COVID-19 di Indonesia,detikHealth,0,jadwal vaksinasi covid di indonesia,"['jadwal', 'vaksinasi', 'covid', 'di', 'indonesia']","['jadwal', 'indonesia']","['jadwal', 'indonesia']"
578,"Daftar Petinggi Negara yang Sudah Vaksin COVID-19, Joe Biden hingga Raja Salman",detikHealth,0,daftar petinggi negara yang sudah vaksin covid joe biden hingga raja salman,"['daftar', 'petinggi', 'negara', 'yang', 'sudah', 'vaksin', 'covid', 'joe', 'biden', 'hingga', 'raja', 'salman']","['daftar', 'petinggi', 'negara', 'joe', 'biden', 'hingga', 'raja', 'salman']","['daftar', 'petinggi', 'negara', 'joe', 'biden', 'hingga', 'raja', 'salman']"
579,"Akhirnya, MUI Pastikan Vaksin Corona Sinovac Suci dan Halal",detikHealth,1,akhirnya mui pastikan vaksin corona sinovac suci dan halal,"['akhirnya', 'mui', 'pastikan', 'vaksin', 'corona', 'sinovac', 'suci', 'dan', 'halal']","['akhirnya', 'mui', 'pastikan', 'sinovac', 'suci', 'halal']","['akhir', 'mui', 'pasti', 'sinovac', 'suci', 'halal']"
580,Jubir Kemenkes Bicara soal Denda Tolak Vaksin Corona,detikHealth,-1,jubir kemenkes bicara soal denda tolak vaksin corona,"['jubir', 'kemenkes', 'bicara', 'soal', 'denda', 'tolak', 'vaksin', 'corona']","['jubir', 'kemenkes', 'bicara', 'soal', 'denda', 'tolak', '']","['jubir', 'kemenkes', 'bicara', 'soal', 'denda', 'tolak', '']"
