,Title,Sumber,Label,Hasil_Case_Folding,Hasil_Token,Hasil_Stopword,Hasil_Stemming
710,Alasan Pentingnya Penyuntikan Vaksin Covid-19 Dosis Kedua...,Kompas,0,alasan pentingnya penyuntikan vaksin covid dosis kedua,"['alasan', 'pentingnya', 'penyuntikan', 'vaksin', 'covid', 'dosis', 'kedua']","['alasan', 'pentingnya', 'penyuntikan', 'dosis', 'kedua']","['alas', 'penting', 'sunti', 'dosis', 'dua']"
711,"Setelah Disuntik Vaksin Corona, 4 Tenaga Medis Dirawat karena Mengalami Gejala Ringan",Kompas,-1,setelah disuntik vaksin corona tenaga medis dirawat karena mengalami gejala ringan,"['setelah', 'disuntik', 'vaksin', 'corona', 'tenaga', 'medis', 'dirawat', 'karena', 'mengalami', 'gejala', 'ringan']","['', 'disuntik', 'tenaga', 'medis', 'dirawat', 'mengalami', 'gejala', 'ringan']","['', 'suntik', 'tenaga', 'medis', 'rawat', 'alami', 'gejala', 'ringan']"
712,Ketua Umum MUI Setuju Ada Sanksi bagi Penolak Vaksinasi Covid-19,Kompas,-1,ketua umum mui setuju ada sanksi bagi penolak vaksinasi covid,"['ketua', 'umum', 'mui', 'setuju', 'ada', 'sanksi', 'bagi', 'penolak', 'vaksinasi', 'covid']","['ketua', 'umum', 'mui', 'setuju', 'sanksi', 'penolak', '']","['ketua', 'umum', 'mui', 'tuju', 'sanksi', 'tolak', '']"
713,"Vaksinasi Covid-19 Tahap Kedua Dimulai 17 Februari, Bertahap, Prioritas Jawa-Bali",Kompas,0,vaksinasi covid tahap kedua dimulai februari bertahap prioritas jawabali,"['vaksinasi', 'covid', 'tahap', 'kedua', 'dimulai', 'februari', 'bertahap', 'prioritas', 'jawabali']","['', 'tahap', 'kedua', 'dimulai', 'februari', 'bertahap', 'prioritas', 'jawabali']","['', 'tahap', 'dua', 'mulai', 'februari', 'tahap', 'prioritas', 'jawabali']"
714,"Jokowi: Tak Mudah Dapatkan Vaksin Covid-19, Rebutan 215 Negara",Kompas,0,jokowi tak mudah dapatkan vaksin covid rebutan negara,"['jokowi', 'tak', 'mudah', 'dapatkan', 'vaksin', 'covid', 'rebutan', 'negara']","['jokowi', 'tak', 'mudah', 'dapatkan', 'rebutan', 'negara']","['jokowi', 'tak', 'mudah', 'dapat', 'rebut', 'negara']"
715,Kemenkes: Antibodi Bisa Terbentuk 99 Persen Setelah Disuntik Dua Dosis Vaksin Sinovac,Kompas,1,kemenkes antibodi bisa terbentuk persen setelah disuntik dua dosis vaksin sinovac,"['kemenkes', 'antibodi', 'bisa', 'terbentuk', 'persen', 'setelah', 'disuntik', 'dua', 'dosis', 'vaksin', 'sinovac']","['kemenkes', 'antibodi', 'terbentuk', 'persen', 'disuntik', 'dosis', 'sinovac']","['kemenkes', 'antibodi', 'bentuk', 'persen', 'suntik', 'dosis', 'sinovac']"
716,"Masuk Kategori Lanjut Usia, Bupati Magetan Suprawoto Terima Vaksin Covid-19",Kompas,0,masuk kategori lanjut usia bupati magetan suprawoto terima vaksin covid,"['masuk', 'kategori', 'lanjut', 'usia', 'bupati', 'magetan', 'suprawoto', 'terima', 'vaksin', 'covid']","['masuk', 'kategori', 'lanjut', 'usia', 'bupati', 'magetan', 'suprawoto', 'terima', '']","['masuk', 'kategori', 'lanjut', 'usia', 'bupati', 'magetan', 'suprawoto', 'terima', '']"
717,"Vaksin Covid-19 Ada Kedaluwarsa, Kemenkes Minta Persediaan Tahap I Dihabiskan",Kompas,0,vaksin covid ada kedaluwarsa kemenkes minta persediaan tahap  dihabiskan,"['vaksin', 'covid', 'ada', 'kedaluwarsa', 'kemenkes', 'minta', 'persediaan', 'tahap', 'dihabiskan']","['', 'kedaluwarsa', 'kemenkes', 'minta', 'persediaan', 'tahap', 'dihabiskan']","['', 'kedaluwarsa', 'kemenkes', 'minta', 'sedia', 'tahap', 'habis']"
718,Kemenkes: Orang yang Sudah Divaksin Covid-19 Masih Mungkin Tertular Virus Corona,Kompas,-1,kemenkes orang yang sudah divaksin covid masih mungkin tertular virus corona,"['kemenkes', 'orang', 'yang', 'sudah', 'divaksin', 'covid', 'masih', 'mungkin', 'tertular', 'virus', 'corona']","['kemenkes', 'orang', 'mungkin', 'tertular', 'virus', '']","['kemenkes', 'orang', 'mungkin', 'tular', 'virus', '']"
719,"Antisipasi Varian Baru Virus Corona, Pemerintah Bentuk Tim Genomik Surveilans",Kompas,0,antisipasi varian baru virus corona pemerintah bentuk tim genomik surveilans,"['antisipasi', 'varian', 'baru', 'virus', 'corona', 'pemerintah', 'bentuk', 'tim', 'genomik', 'surveilans']","['antisipasi', 'varian', 'baru', 'virus', 'pemerintah', 'bentuk', 'tim', 'genomik', 'surveilans']","['antisipasi', 'varian', 'baru', 'virus', 'perintah', 'bentuk', 'tim', 'genomik', 'surveilans']"
720,Ganjar Sebut Vaksinasi Tahap Kedua di Jateng Tertinggi Se-Indonesia,Kompas,1,ganjar sebut vaksinasi tahap kedua di jateng tertinggi seindonesia,"['ganjar', 'sebut', 'vaksinasi', 'tahap', 'kedua', 'di', 'jateng', 'tertinggi', 'seindonesia']","['ganjar', 'sebut', 'tahap', 'kedua', 'jateng', 'tertinggi', 'seindonesia']","['ganjar', 'sebut', 'tahap', 'dua', 'jateng', 'tinggi', 'indonesia']"
721,Ganjar Belum Mau Langsung Sanksi Penolak Vaksin Covid-19,Kompas,1,ganjar belum mau langsung sanksi penolak vaksin covid,"['ganjar', 'belum', 'mau', 'langsung', 'sanksi', 'penolak', 'vaksin', 'covid']","['ganjar', 'mau', 'langsung', 'sanksi', 'penolak', '']","['ganjar', 'mau', 'langsung', 'sanksi', 'tolak', '']"
722,"Soal Sanksi untuk Penolak Vaksinasi Covid-19, Ketua MPR Minta Pemerintah Gencarkan Sosialisasi",Kompas,0,soal sanksi untuk penolak vaksinasi covid ketua mpr minta pemerintah gencarkan sosialisasi,"['soal', 'sanksi', 'untuk', 'penolak', 'vaksinasi', 'covid', 'ketua', 'mpr', 'minta', 'pemerintah', 'gencarkan', 'sosialisasi']","['soal', 'sanksi', 'penolak', 'ketua', 'mpr', 'minta', 'pemerintah', 'gencarkan', 'sosialisasi']","['soal', 'sanksi', 'tolak', 'ketua', 'mpr', 'minta', 'perintah', 'gencar', 'sosialisasi']"
723,Bupati Banyumas soal Pidana untuk Penolak Vaksin: Tindakan Persuasi Dahulu,Kompas,1,bupati banyumas soal pidana untuk penolak vaksin tindakan persuasi dahulu,"['bupati', 'banyumas', 'soal', 'pidana', 'untuk', 'penolak', 'vaksin', 'tindakan', 'persuasi', 'dahulu']","['bupati', 'banyumas', 'soal', 'pidana', 'penolak', 'tindakan', 'persuasi', '']","['bupati', 'banyumas', 'soal', 'pidana', 'tolak', 'tindak', 'persuasi', '']"
724,"Soal Sanksi bagi Penolak Vaksin Covid-19, Kemenkes: Itu Langkah Terakhir",Kompas,0,soal sanksi bagi penolak vaksin covid kemenkes itu langkah terakhir,"['soal', 'sanksi', 'bagi', 'penolak', 'vaksin', 'covid', 'kemenkes', 'itu', 'langkah', 'terakhir']","['soal', 'sanksi', 'penolak', 'kemenkes', 'langkah', 'terakhir']","['soal', 'sanksi', 'tolak', 'kemenkes', 'langkah', 'akhir']"
725,"Perpres Baru Jokowi soal Vaksin Corona: Atur Sanksi, Kompensasi, hingga Penunjukan Langsung",Kompas,0,perpres baru jokowi soal vaksin corona atur sanksi kompensasi hingga penunjukan langsung,"['perpres', 'baru', 'jokowi', 'soal', 'vaksin', 'corona', 'atur', 'sanksi', 'kompensasi', 'hingga', 'penunjukan', 'langsung']","['perpres', 'baru', 'jokowi', 'soal', 'atur', 'sanksi', 'kompensasi', 'hingga', 'penunjukan', 'langsung']","['pres', 'baru', 'jokowi', 'soal', 'atur', 'sanksi', 'kompensasi', 'hingga', 'tunjuk', 'langsung']"
726,UPDATE 14 Februari: 425.578 Tenaga Kesehatan Sudah Disuntik Vaksin Covid-19 Dosis Kedua,Kompas,0,update februari tenaga kesehatan sudah disuntik vaksin covid dosis kedua,"['update', 'februari', 'tenaga', 'kesehatan', 'sudah', 'disuntik', 'vaksin', 'covid', 'dosis', 'kedua']","['update', 'februari', 'tenaga', 'kesehatan', 'disuntik', 'dosis', 'kedua']","['update', 'februari', 'tenaga', 'sehat', 'suntik', 'dosis', 'dua']"
727,Perpres Jokowi: Pemerintah Tanggung Biaya Perawatan jika Ada Efek Samping Vaksinasi Covid-19,Kompas,1,perpres jokowi pemerintah tanggung biaya perawatan jika ada efek samping vaksinasi covid,"['perpres', 'jokowi', 'pemerintah', 'tanggung', 'biaya', 'perawatan', 'jika', 'ada', 'efek', 'samping', 'vaksinasi', 'covid']","['perpres', 'jokowi', 'pemerintah', 'tanggung', 'biaya', 'perawatan', 'efek', 'samping', '']","['pres', 'jokowi', 'perintah', 'tanggung', 'biaya', 'awat', 'efek', 'samping', '']"
728,Perpres Jokowi: Menkes Bisa Tunjuk Badan Usaha Nasional atau Asing sebagai Penyedia Vaksin Covid-19,Kompas,0,perpres jokowi menkes bisa tunjuk badan usaha nasional atau asing sebagai penyedia vaksin covid,"['perpres', 'jokowi', 'menkes', 'bisa', 'tunjuk', 'badan', 'usaha', 'nasional', 'atau', 'asing', 'sebagai', 'penyedia', 'vaksin', 'covid']","['perpres', 'jokowi', 'menkes', 'tunjuk', 'badan', 'usaha', 'nasional', 'asing', 'penyedia', '']","['pres', 'jokowi', 'menkes', 'tunjuk', 'badan', 'usaha', 'nasional', 'asing', 'sedia', '']"
729,Perpres Jokowi: Orang yang Cacat atau Meninggal akibat Vaksin Covid-19 Diberi Santunan,Kompas,1,perpres jokowi orang yang cacat atau meninggal akibat vaksin covid diberi santunan,"['perpres', 'jokowi', 'orang', 'yang', 'cacat', 'atau', 'meninggal', 'akibat', 'vaksin', 'covid', 'diberi', 'santunan']","['perpres', 'jokowi', 'orang', 'cacat', 'meninggal', 'akibat', 'diberi', 'santunan']","['pres', 'jokowi', 'orang', 'cacat', 'tinggal', 'akibat', 'beri', 'santun']"
730,Begini Aturan Teknis Vaksinasi Covid-19 untuk Orang dengan Komorbid,Kompas,0,begini aturan teknis vaksinasi covid untuk orang dengan komorbid,"['begini', 'aturan', 'teknis', 'vaksinasi', 'covid', 'untuk', 'orang', 'dengan', 'komorbid']","['begini', 'aturan', 'teknis', 'orang', 'komorbid']","['begini', 'atur', 'teknis', 'orang', 'komorbid']"
731,"UPDATE: 1,2 Juta Kasus Covid-19 di Indonesia, Vaksinasi Boleh untuk Komorbid hingga Penyintas Covid-19",Kompas,1,update juta kasus covid di indonesia vaksinasi boleh untuk komorbid hingga penyintas covid,"['update', 'juta', 'kasus', 'covid', 'di', 'indonesia', 'vaksinasi', 'boleh', 'untuk', 'komorbid', 'hingga', 'penyintas', 'covid']","['update', 'juta', 'kasus', 'indonesia', 'komorbid', 'hingga', 'penyintas', '']","['update', 'juta', 'kasus', 'indonesia', 'komorbid', 'hingga', 'sintas', '']"
732,"Syarat Lansia, Komorbid, Penyintas, Ibu Menyusui Boleh Mendapatkan Vaksin Covid-19",Kompas,1,syarat lansia komorbid penyintas ibu menyusui boleh mendapatkan vaksin covid,"['syarat', 'lansia', 'komorbid', 'penyintas', 'ibu', 'menyusui', 'boleh', 'mendapatkan', 'vaksin', 'covid']","['syarat', 'lansia', 'komorbid', 'penyintas', 'ibu', 'menyusui', 'mendapatkan', '']","['syarat', 'lansia', 'komorbid', 'sintas', 'ibu', 'susu', 'dapat', '']"
733,"Vaksinasi Covid-19 Nakes Lansia di Solo, Walkot Rudy Pertama Disuntik",Kompas,0,vaksinasi covid nakes lansia di solo walkot rudy pertama disuntik,"['vaksinasi', 'covid', 'nakes', 'lansia', 'di', 'solo', 'walkot', 'rudy', 'pertama', 'disuntik']","['', 'nakes', 'lansia', 'solo', 'walkot', 'rudy', 'pertama', 'disuntik']","['', 'nakes', 'lansia', 'solo', 'walkot', 'rudy', 'pertama', 'suntik']"
734,Pemerintah Klaim Telah Vaksinasi 1 Juta Nakes Kurang dari Satu Bulan,Kompas,1,pemerintah klaim telah vaksinasi juta nakes kurang dari satu bulan,"['pemerintah', 'klaim', 'telah', 'vaksinasi', 'juta', 'nakes', 'kurang', 'dari', 'satu', 'bulan']","['pemerintah', 'klaim', 'juta', 'nakes', 'kurang', 'satu', 'bulan']","['perintah', 'klaim', 'juta', 'nakes', 'kurang', 'satu', 'bulan']"
735,"Gara-gara Tensi Darah Naik dan Faktor Usia, Bupati, Wabup, Sekda Aceh Utara Kompak Batal Disuntik Vaksin Covid-19",Kompas,0,garagara tensi darah naik dan faktor usia bupati wabup sekda aceh utara kompak batal disuntik vaksin covid,"['garagara', 'tensi', 'darah', 'naik', 'dan', 'faktor', 'usia', 'bupati', 'wabup', 'sekda', 'aceh', 'utara', 'kompak', 'batal', 'disuntik', 'vaksin', 'covid']","['garagara', 'tensi', 'darah', 'naik', 'faktor', 'usia', 'bupati', 'wabup', 'sekda', 'aceh', 'utara', 'kompak', 'batal', 'disuntik', '']","['garagara', 'tensi', 'darah', 'naik', 'faktor', 'usia', 'bupati', 'wabup', 'sekda', 'aceh', 'utara', 'kompak', 'batal', 'suntik', '']"
736,Wartawan hingga Pedagang Pasar di Sulut Akan Divaksin Covid-19 Tahap Dua,Kompas,0,wartawan hingga pedagang pasar di sulut akan divaksin covid tahap dua,"['wartawan', 'hingga', 'pedagang', 'pasar', 'di', 'sulut', 'akan', 'divaksin', 'covid', 'tahap', 'dua']","['wartawan', 'hingga', 'pedagang', 'pasar', 'sulut', 'tahap', '']","['wartawan', 'hingga', 'dagang', 'pasar', 'sulut', 'tahap', '']"
737,"Penderita Kanker Diperbolehkan Ikut Vaksinasi Covid-19, Ini Syaratnya",Kompas,1,penderita kanker diperbolehkan ikut vaksinasi covid ini syaratnya,"['penderita', 'kanker', 'diperbolehkan', 'ikut', 'vaksinasi', 'covid', 'ini', 'syaratnya']","['penderita', 'kanker', 'diperbolehkan', 'ikut', 'syaratnya']","['derita', 'kanker', 'boleh', 'ikut', 'syarat']"
738,"Awal Maret 2021, Wartawan di Grobogan Akan Divaksin",Kompas,0,awal maret wartawan di grobogan akan divaksin,"['awal', 'maret', 'wartawan', 'di', 'grobogan', 'akan', 'divaksin']","['awal', 'maret', 'wartawan', 'grobogan', '']","['awal', 'maret', 'wartawan', 'grobogan', '']"
739,Kemenkominfo Temukan 105 Isu Hoaks Terkait Vaksin Covid-19 ,Kompas,-1,kemenkominfo temukan isu hoaks terkait vaksin covid,"['kemenkominfo', 'temukan', 'isu', 'hoaks', 'terkait', 'vaksin', 'covid']","['kemenkominfo', 'temukan', 'isu', 'hoaks', 'terkait', '']","['kemenkominfo', 'temu', 'isu', 'hoaks', 'kait', '']"
740,UPDATE 10 Februari: Kasus Aktif Covid-19 di Indonesia Tercatat 168.416,Kompas,0,update februari kasus aktif covid di indonesia tercatat,"['update', 'februari', 'kasus', 'aktif', 'covid', 'di', 'indonesia', 'tercatat']","['update', 'februari', 'kasus', 'aktif', 'indonesia', 'tercatat']","['update', 'februari', 'kasus', 'aktif', 'indonesia', 'catat']"
741,UPDATE 10 Februari: 969.546 Tenaga Kesehatan Disuntik Vaksin Covid-19 Dosis Pertama,Kompas,0,update februari tenaga kesehatan disuntik vaksin covid dosis pertama,"['update', 'februari', 'tenaga', 'kesehatan', 'disuntik', 'vaksin', 'covid', 'dosis', 'pertama']","['update', 'februari', 'tenaga', 'kesehatan', 'disuntik', 'dosis', 'pertama']","['update', 'februari', 'tenaga', 'sehat', 'suntik', 'dosis', 'pertama']"
742,"Helena Lim Divaksin Lebih Awal, Epidemiolog: Memprihatinkan, Harus Diklarifikasi",Kompas,0,helena lim divaksin lebih awal epidemiolog memprihatinkan harus diklarifikasi,"['helena', 'lim', 'divaksin', 'lebih', 'awal', 'epidemiolog', 'memprihatinkan', 'harus', 'diklarifikasi']","['helena', 'lim', 'lebih', 'awal', 'epidemiolog', 'memprihatinkan', 'diklarifikasi']","['helena', 'lim', 'lebih', 'awal', 'epidemiolog', 'prihatin', 'klarifikasi']"
743,Petugas Pelayanan Publik hingga Wartawan di Wonogiri Akan Divaksin Covid-19 Tahap Kedua,Kompas,0,petugas pelayanan publik hingga wartawan di wonogiri akan divaksin covid tahap kedua,"['petugas', 'pelayanan', 'publik', 'hingga', 'wartawan', 'di', 'wonogiri', 'akan', 'divaksin', 'covid', 'tahap', 'kedua']","['petugas', 'pelayanan', 'publik', 'hingga', 'wartawan', 'wonogiri', 'tahap', 'kedua']","['tugas', 'layan', 'publik', 'hingga', 'wartawan', 'wonogiri', 'tahap', 'dua']"
744,"Kemenkes: Jika Helena Lim Dapat Vaksin Covid-19, Kemungkinan Namanya Terdaftar di Dinkes",Kompas,0,kemenkes jika helena lim dapat vaksin covid kemungkinan namanya terdaftar di dinkes,"['kemenkes', 'jika', 'helena', 'lim', 'dapat', 'vaksin', 'covid', 'kemungkinan', 'namanya', 'terdaftar', 'di', 'dinkes']","['kemenkes', 'helena', 'lim', 'kemungkinan', 'namanya', 'terdaftar', 'dinkes']","['kemenkes', 'helena', 'lim', 'mungkin', 'nama', 'daftar', 'dinkes']"
745,Kontroversi Penyuntikan Vaksin ke Helena Lim dan Tanggapan Kemenkes soal Prioritas Vaksinasi Covid-19,Kompas,0,kontroversi penyuntikan vaksin ke helena lim dan tanggapan kemenkes soal prioritas vaksinasi covid,"['kontroversi', 'penyuntikan', 'vaksin', 'ke', 'helena', 'lim', 'dan', 'tanggapan', 'kemenkes', 'soal', 'prioritas', 'vaksinasi', 'covid']","['kontroversi', 'penyuntikan', 'helena', 'lim', 'tanggapan', 'kemenkes', 'soal', 'prioritas', '']","['kontroversi', 'sunti', 'helena', 'lim', 'tanggap', 'kemenkes', 'soal', 'prioritas', '']"
746,Dinas Kesehatan Jatim Ajukan Tambahan 104.252 Dosis Vaksin Covid-19,Kompas,0,dinas kesehatan jatim ajukan tambahan dosis vaksin covid,"['dinas', 'kesehatan', 'jatim', 'ajukan', 'tambahan', 'dosis', 'vaksin', 'covid']","['dinas', 'kesehatan', 'jatim', 'ajukan', 'tambahan', 'dosis', '']","['dinas', 'sehat', 'jatim', 'aju', 'tambah', 'dosis', '']"
747,ICJR Minta Petugas dan Penghuni Lapas Masuk Prioritas Vaksinasi Covid-19,Kompas,0,icjr minta petugas dan penghuni lapas masuk prioritas vaksinasi covid,"['icjr', 'minta', 'petugas', 'dan', 'penghuni', 'lapas', 'masuk', 'prioritas', 'vaksinasi', 'covid']","['icjr', 'minta', 'petugas', 'penghuni', 'lapas', 'masuk', 'prioritas', '']","['icjr', 'minta', 'tugas', 'huni', 'lapas', 'masuk', 'prioritas', '']"
748,Kemenristek: Eijkman Targetkan Kirim Bibit Vaksin Merah Putih ke Bio Farma Maret 2021,Kompas,0,kemenristek eijkman targetkan kirim bibit vaksin merah putih ke bio farma maret,"['kemenristek', 'eijkman', 'targetkan', 'kirim', 'bibit', 'vaksin', 'merah', 'putih', 'ke', 'bio', 'farma', 'maret']","['kemenristek', 'eijkman', 'targetkan', 'kirim', 'bibit', 'merah', 'putih', 'bio', 'farma', 'maret']","['kemenristek', 'eijkman', 'target', 'kirim', 'bibit', 'merah', 'putih', 'bio', 'farma', 'maret']"
749,Baru 411 Nakes Padang Panjang yang Disuntik Vaksin Covid-19 dari Target 1.460 Orang,Kompas,0,baru nakes padang panjang yang disuntik vaksin covid dari target orang,"['baru', 'nakes', 'padang', 'panjang', 'yang', 'disuntik', 'vaksin', 'covid', 'dari', 'target', 'orang']","['baru', 'nakes', 'padang', 'panjang', 'disuntik', 'target', 'orang']","['baru', 'nakes', 'padang', 'panjang', 'suntik', 'target', 'orang']"
750,"Ketua IDI Palopo Positif Covid-19 Sepekan Usai Divaksin, Ini Penjelasan Satgas",Kompas,-1,ketua idi palopo positif covid sepekan usai divaksin ini penjelasan satgas,"['ketua', 'idi', 'palopo', 'positif', 'covid', 'sepekan', 'usai', 'divaksin', 'ini', 'penjelasan', 'satgas']","['ketua', 'idi', 'palopo', 'positif', 'sepekan', 'usai', 'penjelasan', 'satgas']","['ketua', 'idi', 'palopo', 'positif', 'pek', 'usai', 'jelas', 'satgas']"
751,"Vaksinasi Tahap Kedua di Banyumas Dimulai Bulan Ini, Sasaran 60.000 Orang",Kompas,0,vaksinasi tahap kedua di banyumas dimulai bulan ini sasaran orang,"['vaksinasi', 'tahap', 'kedua', 'di', 'banyumas', 'dimulai', 'bulan', 'ini', 'sasaran', 'orang']","['', 'tahap', 'kedua', 'banyumas', 'dimulai', 'bulan', 'sasaran', 'orang']","['', 'tahap', 'dua', 'banyumas', 'mulai', 'bulan', 'sasar', 'orang']"
752,Vaksinasi Tahap Kedua di Pekalongan Dilakukan pada Pertengahan Februari 2021,Kompas,0,vaksinasi tahap kedua di pekalongan dilakukan pada pertengahan februari,"['vaksinasi', 'tahap', 'kedua', 'di', 'pekalongan', 'dilakukan', 'pada', 'pertengahan', 'februari']","['', 'tahap', 'kedua', 'pekalongan', 'dilakukan', 'pertengahan', 'februari']","['', 'tahap', 'dua', 'kalong', 'laku', 'tengah', 'februari']"
753,Para Profesor Tenaga Kesehatan yang Sudah Lansia Mulai Terima Vaksin Covid-19,Kompas,0,para profesor tenaga kesehatan yang sudah lansia mulai terima vaksin covid,"['para', 'profesor', 'tenaga', 'kesehatan', 'yang', 'sudah', 'lansia', 'mulai', 'terima', 'vaksin', 'covid']","['', 'profesor', 'tenaga', 'kesehatan', 'lansia', 'mulai', 'terima', '']","['', 'profesor', 'tenaga', 'sehat', 'lansia', 'mulai', 'terima', '']"
754,"4.581 Nakes Tidak Divaksin, Ini Penjelasan Dinas Kesehatan Kalbar",Kompas,0,nakes tidak divaksin ini penjelasan dinas kesehatan kalbar,"['nakes', 'tidak', 'divaksin', 'ini', 'penjelasan', 'dinas', 'kesehatan', 'kalbar']","['nakes', 'penjelasan', 'dinas', 'kesehatan', 'kalbar']","['nakes', 'jelas', 'dinas', 'sehat', 'kalbar']"
755,"Jubir Vaksinasi: Sabar, Jangan Langgar Hukum untuk Dapatkan Vaksin Covid-19",Kompas,0,jubir vaksinasi sabar jangan langgar hukum untuk dapatkan vaksin covid,"['jubir', 'vaksinasi', 'sabar', 'jangan', 'langgar', 'hukum', 'untuk', 'dapatkan', 'vaksin', 'covid']","['jubir', 'sabar', 'jangan', 'langgar', 'hukum', 'dapatkan', '']","['jubir', 'sabar', 'jangan', 'langgar', 'hukum', 'dapat', '']"
756,Apa yang Ilmuwan Ketahui tentang Varian Baru Virus Corona dan Vaksin?,Kompas,0,apa yang ilmuwan ketahui tentang varian baru virus corona dan vaksin,"['apa', 'yang', 'ilmuwan', 'ketahui', 'tentang', 'varian', 'baru', 'virus', 'corona', 'dan', 'vaksin']","['apa', 'ilmuwan', 'ketahui', 'varian', 'baru', 'virus', '']","['apa', 'ilmuwan', 'tahu', 'varian', 'baru', 'virus', '']"
757,Wali Kota Salatiga Ungkap Pengalaman Usai Divaksin Covid-19 Dosis Kedua,Kompas,0,wali kota salatiga ungkap pengalaman usai divaksin covid dosis kedua,"['wali', 'kota', 'salatiga', 'ungkap', 'pengalaman', 'usai', 'divaksin', 'covid', 'dosis', 'kedua']","['wali', 'kota', 'salatiga', 'ungkap', 'pengalaman', 'usai', 'dosis', 'kedua']","['wali', 'kota', 'salatiga', 'ungkap', 'alam', 'usai', 'dosis', 'dua']"
758,"Vaksin Covid-19 Sinovac untuk Lansia, Diawali dari Kritik Pandu Riono hingga Disahkan Pemerintah",Kompas,0,vaksin covid sinovac untuk lansia diawali dari kritik pandu riono hingga disahkan pemerintah,"['vaksin', 'covid', 'sinovac', 'untuk', 'lansia', 'diawali', 'dari', 'kritik', 'pandu', 'riono', 'hingga', 'disahkan', 'pemerintah']","['', 'sinovac', 'lansia', 'diawali', 'kritik', 'pandu', 'riono', 'hingga', 'disahkan', 'pemerintah']","['', 'sinovac', 'lansia', 'awal', 'kritik', 'pandu', 'riono', 'hingga', 'sah', 'perintah']"
759,2.017 Nakes dan 7 Pejabat Jalani Vaksinasi Covid-19 Dosis Kedua di Tegal,Kompas,0,nakes dan pejabat jalani vaksinasi covid dosis kedua di tegal,"['nakes', 'dan', 'pejabat', 'jalani', 'vaksinasi', 'covid', 'dosis', 'kedua', 'di', 'tegal']","['nakes', 'pejabat', 'jalani', 'dosis', 'kedua', 'tegal']","['nakes', 'jabat', 'jalan', 'dosis', 'dua', 'tegal']"
760,"Vaksin Lansia Diizinkan BPOM, Screening Ketat Dinilai Perlu untuk Pantau Komorbid",Kompas,0,vaksin lansia diizinkan bpom screening ketat dinilai perlu untuk pantau komorbid,"['vaksin', 'lansia', 'diizinkan', 'bpom', 'screening', 'ketat', 'dinilai', 'perlu', 'untuk', 'pantau', 'komorbid']","['', 'lansia', 'diizinkan', 'bpom', 'screening', 'ketat', 'dinilai', 'perlu', 'pantau', 'komorbid']","['', 'lansia', 'izin', 'bpom', 'screening', 'ketat', 'nilai', 'perlu', 'pantau', 'komorbid']"
761,"Agar Pandemi Tak Berlanjut hingga 10 Tahun, Ini 3 Saran IDI untuk Pemerintah",Kompas,0,agar pandemi tak berlanjut hingga tahun ini saran idi untuk pemerintah,"['agar', 'pandemi', 'tak', 'berlanjut', 'hingga', 'tahun', 'ini', 'saran', 'idi', 'untuk', 'pemerintah']","['', 'pandemi', 'tak', 'berlanjut', 'hingga', 'tahun', 'saran', 'idi', 'pemerintah']","['', 'pandemi', 'tak', 'lanjut', 'hingga', 'tahun', 'saran', 'idi', 'perintah']"
762,BPOM Ingatkan Agar Vaksinasi Covid-19 pada Lansia Dilakukan Hati-hati,Kompas,0,bpom ingatkan agar vaksinasi covid pada lansia dilakukan hatihati,"['bpom', 'ingatkan', 'agar', 'vaksinasi', 'covid', 'pada', 'lansia', 'dilakukan', 'hatihati']","['bpom', 'ingatkan', 'lansia', 'dilakukan', 'hatihati']","['bpom', 'ingat', 'lansia', 'laku', 'hatihati']"
763,"Menkes Sebut Lebih dari 100.000 Nakes Batal Disuntik Vaksin Covid-19, Ini Penyebabnya",Kompas,0,menkes sebut lebih dari nakes batal disuntik vaksin covid ini penyebabnya,"['menkes', 'sebut', 'lebih', 'dari', 'nakes', 'batal', 'disuntik', 'vaksin', 'covid', 'ini', 'penyebabnya']","['menkes', 'sebut', 'lebih', 'nakes', 'batal', 'disuntik', 'penyebabnya']","['menkes', 'sebut', 'lebih', 'nakes', 'batal', 'suntik', 'sebab']"
764,"Usai Vaksinasi Nakes Lansia, secara Paralel Lansia Lain Akan Diberi Vaksin Covid-19",Kompas,0,usai vaksinasi nakes lansia secara paralel lansia lain akan diberi vaksin covid,"['usai', 'vaksinasi', 'nakes', 'lansia', 'secara', 'paralel', 'lansia', 'lain', 'akan', 'diberi', 'vaksin', 'covid']","['usai', 'nakes', 'lansia', 'paralel', 'lansia', 'diberi', '']","['usai', 'nakes', 'lansia', 'paralel', 'lansia', 'beri', '']"
765,"Angka Kematian Tinggi, BPOM Izinkan Penggunaan Vaksin CoronaVac untuk Lansia",Kompas,0,angka kematian tinggi bpom izinkan penggunaan vaksin coronavac untuk lansia,"['angka', 'kematian', 'tinggi', 'bpom', 'izinkan', 'penggunaan', 'vaksin', 'coronavac', 'untuk', 'lansia']","['angka', 'kematian', 'tinggi', 'bpom', 'izinkan', 'penggunaan', 'coronavac', 'lansia']","['angka', 'mati', 'tinggi', 'bpom', 'izin', 'guna', 'coronavac', 'lansia']"
766,Menkes: Vaksinasi Covid-19 untuk Nakes Lansia Dimulai Senin Besok,Kompas,0,menkes vaksinasi covid untuk nakes lansia dimulai senin besok,"['menkes', 'vaksinasi', 'covid', 'untuk', 'nakes', 'lansia', 'dimulai', 'senin', 'besok']","['menkes', 'nakes', 'lansia', 'dimulai', 'senin', 'besok']","['menkes', 'nakes', 'lansia', 'mulai', 'senin', 'besok']"
767,Tingginya Angka Kematian Jadi Alasan BPOM Bolehkan Lansia Disuntik Vaksin Sinovac,Kompas,0,tingginya angka kematian jadi alasan bpom bolehkan lansia disuntik vaksin sinovac,"['tingginya', 'angka', 'kematian', 'jadi', 'alasan', 'bpom', 'bolehkan', 'lansia', 'disuntik', 'vaksin', 'sinovac']","['tingginya', 'angka', 'kematian', 'jadi', 'alasan', 'bpom', 'bolehkan', 'lansia', 'disuntik', 'sinovac']","['tinggi', 'angka', 'mati', 'jadi', 'alas', 'bpom', 'boleh', 'lansia', 'suntik', 'sinovac']"
768,BPOM Terbitkan Izin Penggunaan Darurat Vaksin Covid-19 Sinovac untuk Lansia,Kompas,0,bpom terbitkan izin penggunaan darurat vaksin covid sinovac untuk lansia,"['bpom', 'terbitkan', 'izin', 'penggunaan', 'darurat', 'vaksin', 'covid', 'sinovac', 'untuk', 'lansia']","['bpom', 'terbitkan', 'izin', 'penggunaan', 'darurat', 'sinovac', 'lansia']","['bpom', 'terbit', 'izin', 'guna', 'darurat', 'sinovac', 'lansia']"
769,UPDATE 7 Februari: 784.318 Tenaga Kesehatan Disuntik Vaksin Covid-19 Dosis Pertama,Kompas,0,update februari tenaga kesehatan disuntik vaksin covid dosis pertama,"['update', 'februari', 'tenaga', 'kesehatan', 'disuntik', 'vaksin', 'covid', 'dosis', 'pertama']","['update', 'februari', 'tenaga', 'kesehatan', 'disuntik', 'dosis', 'pertama']","['update', 'februari', 'tenaga', 'sehat', 'suntik', 'dosis', 'pertama']"
