,Title,Sumber,Label,Hasil_Case_Folding,Hasil_Token,Hasil_Stopword,Hasil_Stemming
300,Wah! UE Tak Bakal Perpanjang Kontrak Vaksin AstraZeneca?,cnbcindonesia,0,wah ue tak bakal perpanjang kontrak vaksin astrazeneca,"['wah', 'ue', 'tak', 'bakal', 'perpanjang', 'kontrak', 'vaksin', 'astrazeneca']","['wah', 'ue', 'tak', 'bakal', 'perpanjang', 'kontrak', 'astrazeneca']","['wah', 'ue', 'tak', 'bakal', 'panjang', 'kontrak', 'astrazeneca']"
301,Satgas Covid Bicara Kejanggalan Vaksin Nusantara Terawan,cnbcindonesia,0,satgas covid bicara kejanggalan vaksin nusantara terawan,"['satgas', 'covid', 'bicara', 'kejanggalan', 'vaksin', 'nusantara', 'terawan']","['satgas', 'bicara', 'kejanggalan', 'nusantara', 'terawan']","['satgas', 'bicara', 'janggal', 'nusantara', 'awan']"
302,"Viral, Molnupiravir 'Obat' Baru yang Bisa Sikat Covid-19",cnbcindonesia,1,viral molnupiravir obat baru yang bisa sikat covid,"['viral', 'molnupiravir', 'obat', 'baru', 'yang', 'bisa', 'sikat', 'covid']","['viral', 'molnupiravir', 'obat', 'baru', 'sikat', '']","['viral', 'molnupiravir', 'obat', 'baru', 'sikat', '']"
303,"Sertifikat Vaksin Belum Jadi Syarat Perjalanan, Ini Alasannya",cnbcindonesia,0,sertifikat vaksin belum jadi syarat perjalanan ini alasannya,"['sertifikat', 'vaksin', 'belum', 'jadi', 'syarat', 'perjalanan', 'ini', 'alasannya']","['sertifikat', 'jadi', 'syarat', 'perjalanan', 'alasannya']","['sertifikat', 'jadi', 'syarat', 'jalan', 'alas']"
304,"Bela China, Turki: Vaksin Sinovac Sangat Efektif Lawan Covid",cnbcindonesia,1,bela china turki vaksin sinovac sangat efektif lawan covid,"['bela', 'china', 'turki', 'vaksin', 'sinovac', 'sangat', 'efektif', 'lawan', 'covid']","['bela', 'china', 'turki', 'sinovac', 'sangat', 'efektif', 'lawan', '']","['bela', 'china', 'turki', 'sinovac', 'sangat', 'efektif', 'lawan', '']"
305,Kontroversi Vaksin Nusantara yang Mulai Disuntikkan Hari Ini,cnbcindonesia,0,kontroversi vaksin nusantara yang mulai disuntikkan hari ini,"['kontroversi', 'vaksin', 'nusantara', 'yang', 'mulai', 'disuntikkan', 'hari', 'ini']","['kontroversi', 'nusantara', 'mulai', 'disuntikkan', 'hari', '']","['kontroversi', 'nusantara', 'mulai', 'suntik', 'hari', '']"
306,Gatot Nurmantyo Ikut Disuntik Vaksin Nusantara Terawan,cnbcindonesia,0,gatot nurmantyo ikut disuntik vaksin nusantara terawan,"['gatot', 'nurmantyo', 'ikut', 'disuntik', 'vaksin', 'nusantara', 'terawan']","['gatot', 'nurmantyo', 'ikut', 'disuntik', 'nusantara', 'terawan']","['gatot', 'nurmantyo', 'ikut', 'suntik', 'nusantara', 'awan']"
307,Beberapa Anggota DPR Disuntik Vaksin Nusantara Hari Ini,cnbcindonesia,0,beberapa anggota dpr disuntik vaksin nusantara hari ini,"['beberapa', 'anggota', 'dpr', 'disuntik', 'vaksin', 'nusantara', 'hari', 'ini']","['beberapa', 'anggota', 'dpr', 'disuntik', 'nusantara', 'hari', '']","['beberapa', 'anggota', 'dpr', 'suntik', 'nusantara', 'hari', '']"
308,Berapa Lama Vaksin Moderna Lindungi Tubuh dari Covid-19?,cnbcindonesia,1,berapa lama vaksin moderna lindungi tubuh dari covid,"['berapa', 'lama', 'vaksin', 'moderna', 'lindungi', 'tubuh', 'dari', 'covid']","['berapa', 'lama', 'moderna', 'lindungi', 'tubuh', '']","['berapa', 'lama', 'moderna', 'lindung', 'tubuh', '']"
309,"Besok, Sejumlah Anggota DPR Disuntik Vaksin Nusantara Terawan",cnbcindonesia,0,besok sejumlah anggota dpr disuntik vaksin nusantara terawan,"['besok', 'sejumlah', 'anggota', 'dpr', 'disuntik', 'vaksin', 'nusantara', 'terawan']","['besok', 'sejumlah', 'anggota', 'dpr', 'disuntik', 'nusantara', 'terawan']","['besok', 'jumlah', 'anggota', 'dpr', 'suntik', 'nusantara', 'awan']"
310,BPOM Buka-bukaan Soal Tahapan Uji Vaksin Covid-19 di RI,cnbcindonesia,0,bpom bukabukaan soal tahapan uji vaksin covid di ri,"['bpom', 'bukabukaan', 'soal', 'tahapan', 'uji', 'vaksin', 'covid', 'di', 'ri']","['bpom', 'bukabukaan', 'soal', 'tahapan', 'uji', 'ri']","['bpom', 'bukabukaan', 'soal', 'tahap', 'uji', 'ri']"
311,Alasan Menkes RI Pakai 4 Vaksin Covid-19 Buat Lawan Covid,cnbcindonesia,0,alasan menkes ri pakai vaksin covid buat lawan covid,"['alasan', 'menkes', 'ri', 'pakai', 'vaksin', 'covid', 'buat', 'lawan', 'covid']","['alasan', 'menkes', 'ri', 'pakai', 'buat', 'lawan', '']","['alas', 'menkes', 'ri', 'pakai', 'buat', 'lawan', '']"
312,"Pembekuan Darah, Regulator AS: Setop Pakai Vaksin Covid J&J",cnbcindonesia,-1,pembekuan darah regulator as setop pakai vaksin covid jj,"['pembekuan', 'darah', 'regulator', 'as', 'setop', 'pakai', 'vaksin', 'covid', 'jj']","['pembekuan', 'darah', 'regulator', 'as', 'setop', 'pakai', 'jj']","['beku', 'darah', 'regulator', 'as', 'setop', 'pakai', 'jj']"
313,Menristek Bongkar Perkembangan Vaksin Made in RI,cnbcindonesia,0,menristek bongkar perkembangan vaksin made in ri,"['menristek', 'bongkar', 'perkembangan', 'vaksin', 'made', 'in', 'ri']","['menristek', 'bongkar', 'perkembangan', 'made', 'in', 'ri']","['menristek', 'bongkar', 'kembang', 'made', 'in', 'ri']"
314,Bambang Brodjonegoro Beberkan Karya Anak Bangsa Lawan Covid,cnbcindonesia,0,bambang brodjonegoro beberkan karya anak bangsa lawan covid,"['bambang', 'brodjonegoro', 'beberkan', 'karya', 'anak', 'bangsa', 'lawan', 'covid']","['bambang', 'brodjonegoro', 'beberkan', 'karya', 'anak', 'bangsa', 'lawan', '']","['bambang', 'brodjonegoro', 'kan', 'karya', 'anak', 'bangsa', 'lawan', '']"
315,Pembekuan Darah Usai Divaksin AstraZeneca Muncul Lagi,cnbcindonesia,-1,pembekuan darah usai divaksin astrazeneca muncul lagi,"['pembekuan', 'darah', 'usai', 'divaksin', 'astrazeneca', 'muncul', 'lagi']","['pembekuan', 'darah', 'usai', 'astrazeneca', 'muncul', '']","['beku', 'darah', 'usai', 'astrazeneca', 'muncul', '']"
316,"Cuma Salah Paham, China Bantah Soal Vaksinnya Kurang Manjur",cnbcindonesia,-1,cuma salah paham china bantah soal vaksinnya kurang manjur,"['cuma', 'salah', 'paham', 'china', 'bantah', 'soal', 'vaksinnya', 'kurang', 'manjur']","['cuma', 'salah', 'paham', 'china', 'bantah', 'soal', 'vaksinnya', 'kurang', 'manjur']","['cuma', 'salah', 'paham', 'china', 'bantah', 'soal', 'vaksin', 'kurang', 'manjur']"
317,"Darurat Covid Meledak, India Pakai Vaksin Rusia Sputnik V",cnbcindonesia,0,darurat covid meledak india pakai vaksin rusia sputnik ,"['darurat', 'covid', 'meledak', 'india', 'pakai', 'vaksin', 'rusia', 'sputnik', '']","['darurat', 'meledak', 'india', 'pakai', 'rusia', 'sputnik']","['darurat', 'ledak', 'india', 'pakai', 'rusia', 'sputnik']"
318,"Jokowi Hapus Kemenristek, Gimana Nasib Vaksin Made in RI?",cnbcindonesia,0,jokowi hapus kemenristek gimana nasib vaksin made in ri,"['jokowi', 'hapus', 'kemenristek', 'gimana', 'nasib', 'vaksin', 'made', 'in', 'ri']","['jokowi', 'hapus', 'kemenristek', 'gimana', 'nasib', 'made', 'in', 'ri']","['jokowi', 'hapus', 'kemenristek', 'gimana', 'nasib', 'made', 'in', 'ri']"
319,"Heboh China Akui Kemanjuran Vaksinnya Rendah, Faktanya?",cnbcindonesia,-1,heboh china akui kemanjuran vaksinnya rendah faktanya,"['heboh', 'china', 'akui', 'kemanjuran', 'vaksinnya', 'rendah', 'faktanya']","['heboh', 'china', 'akui', 'kemanjuran', 'vaksinnya', 'rendah', 'faktanya']","['heboh', 'china', 'aku', 'manjur', 'vaksin', 'rendah', 'fakta']"
320,"Di Hadapan Jokowi, Merkel Janji Bantu Vaksinasi Negara Miskin",cnbcindonesia,1,di hadapan jokowi merkel janji bantu vaksinasi negara miskin,"['di', 'hadapan', 'jokowi', 'merkel', 'janji', 'bantu', 'vaksinasi', 'negara', 'miskin']","['', 'hadapan', 'jokowi', 'merkel', 'janji', 'bantu', 'negara', 'miskin']","['', 'hadap', 'jokowi', 'merkel', 'janji', 'bantu', 'negara', 'miskin']"
321,Bambang Brodjonegoro Pamer N29 Hingga Drone di Hannover Messe,cnbcindonesia,0,bambang brodjonegoro pamer  hingga drone di hannover messe,"['bambang', 'brodjonegoro', 'pamer', 'hingga', 'drone', 'di', 'hannover', 'messe']","['bambang', 'brodjonegoro', 'pamer', 'hingga', 'drone', 'hannover', 'messe']","['bambang', 'brodjonegoro', 'pamer', 'hingga', 'drone', 'hannover', 'messe']"
322,"China Akui Kemanjuran Vaksinnya Rendah, Berapa Efikasinya?",cnbcindonesia,-1,china akui kemanjuran vaksinnya rendah berapa efikasinya,"['china', 'akui', 'kemanjuran', 'vaksinnya', 'rendah', 'berapa', 'efikasinya']","['china', 'akui', 'kemanjuran', 'vaksinnya', 'rendah', 'berapa', 'efikasinya']","['china', 'aku', 'manjur', 'vaksin', 'rendah', 'berapa', 'efikasinya']"
323,Duh! Vaksin Pfizer Kurang Efektif Lawan Mutasi Corona Afsel,cnbcindonesia,-1,duh vaksin pfizer kurang efektif lawan mutasi corona afsel,"['duh', 'vaksin', 'pfizer', 'kurang', 'efektif', 'lawan', 'mutasi', 'corona', 'afsel']","['duh', 'pfizer', 'kurang', 'efektif', 'lawan', 'mutasi', 'afsel']","['duh', 'pfizer', 'kurang', 'efektif', 'lawan', 'mutasi', 'afsel']"
324,"Akui Kemanjuran Rendah, China Bakal Campur Vaksin Corona",cnbcindonesia,-1,akui kemanjuran rendah china bakal campur vaksin corona,"['akui', 'kemanjuran', 'rendah', 'china', 'bakal', 'campur', 'vaksin', 'corona']","['akui', 'kemanjuran', 'rendah', 'china', 'bakal', 'campur', '']","['aku', 'manjur', 'rendah', 'china', 'bakal', 'campur', '']"
325,"Banyak Kontroversi, Ini Sederet Fakta Vaksin AstraZeneca",cnbcindonesia,0,banyak kontroversi ini sederet fakta vaksin astrazeneca,"['banyak', 'kontroversi', 'ini', 'sederet', 'fakta', 'vaksin', 'astrazeneca']","['banyak', 'kontroversi', 'sederet', 'fakta', 'astrazeneca']","['banyak', 'kontroversi', 'deret', 'fakta', 'astrazeneca']"
326,"China Mau Buat ""Ramuan Ajaib"" Baru Buat Lawan Corona",cnbcindonesia,1,china mau buat ramuan ajaib baru buat lawan corona,"['china', 'mau', 'buat', 'ramuan', 'ajaib', 'baru', 'buat', 'lawan', 'corona']","['china', 'mau', 'buat', 'ramuan', 'ajaib', 'baru', 'buat', 'lawan', '']","['china', 'mau', 'buat', 'ramu', 'ajaib', 'baru', 'buat', 'lawan', '']"
327,Kabar Buruk! Vaksin Pfizer Tak Kuat Lawan Virus Corona Afsel,cnbcindonesia,-1,kabar buruk vaksin pfizer tak kuat lawan virus corona afsel,"['kabar', 'buruk', 'vaksin', 'pfizer', 'tak', 'kuat', 'lawan', 'virus', 'corona', 'afsel']","['kabar', 'buruk', 'pfizer', 'tak', 'kuat', 'lawan', 'virus', 'afsel']","['kabar', 'buruk', 'pfizer', 'tak', 'kuat', 'lawan', 'virus', 'afsel']"
328,Pakai Masker Usai Divaksin Bisa Lindungi Nyawa Ribuan Orang,cnbcindonesia,1,pakai masker usai divaksin bisa lindungi nyawa ribuan orang,"['pakai', 'masker', 'usai', 'divaksin', 'bisa', 'lindungi', 'nyawa', 'ribuan', 'orang']","['pakai', 'masker', 'usai', 'lindungi', 'nyawa', 'ribuan', 'orang']","['pakai', 'masker', 'usai', 'lindung', 'nyawa', 'ribu', 'orang']"
329,Duh! 4 Orang Alami Pembekuan Darah Usai Divaksin Covid Ini,cnbcindonesia,-1,duh orang alami pembekuan darah usai divaksin covid ini,"['duh', 'orang', 'alami', 'pembekuan', 'darah', 'usai', 'divaksin', 'covid', 'ini']","['duh', 'orang', 'alami', 'pembekuan', 'darah', 'usai', '']","['duh', 'orang', 'alami', 'beku', 'darah', 'usai', '']"
330,Catat! Ini 5 Vaksin Covid yang Sedang Dikaji BPOM RI,cnbcindonesia,0,catat ini vaksin covid yang sedang dikaji bpom ri,"['catat', 'ini', 'vaksin', 'covid', 'yang', 'sedang', 'dikaji', 'bpom', 'ri']","['catat', 'sedang', 'dikaji', 'bpom', 'ri']","['catat', 'sedang', 'kaji', 'bpom', 'ri']"
331,"China 'Ngegas', Janji Produksi 3 Miliar Vaksin Covid di 2021",cnbcindonesia,1,china ngegas janji produksi miliar vaksin covid di,"['china', 'ngegas', 'janji', 'produksi', 'miliar', 'vaksin', 'covid', 'di']","['china', 'ngegas', 'janji', 'produksi', 'miliar', '']","['china', 'ngegas', 'janji', 'produksi', 'miliar', '']"
332,"Jangan Salah, Ini Alasan Muncul Efek Samping Vaksin Covid-19",cnbcindonesia,-1,jangan salah ini alasan muncul efek samping vaksin covid,"['jangan', 'salah', 'ini', 'alasan', 'muncul', 'efek', 'samping', 'vaksin', 'covid']","['jangan', 'salah', 'alasan', 'muncul', 'efek', 'samping', '']","['jangan', 'salah', 'alas', 'muncul', 'efek', 'samping', '']"
333,UE Minta Pembekuan Darah Masuk Efek Samping Vaksin Covid-19,cnbcindonesia,-1,ue minta pembekuan darah masuk efek samping vaksin covid,"['ue', 'minta', 'pembekuan', 'darah', 'masuk', 'efek', 'samping', 'vaksin', 'covid']","['ue', 'minta', 'pembekuan', 'darah', 'masuk', 'efek', 'samping', '']","['ue', 'minta', 'beku', 'darah', 'masuk', 'efek', 'samping', '']"
334,"Miris! WHO Sebut Negara Miskin Cuma Dapat 0,2% Stok Vaksin",cnbcindonesia,-1,miris who sebut negara miskin cuma dapat stok vaksin,"['miris', 'who', 'sebut', 'negara', 'miskin', 'cuma', 'dapat', 'stok', 'vaksin']","['miris', 'who', 'sebut', 'negara', 'miskin', 'cuma', 'stok', '']","['miris', 'who', 'sebut', 'negara', 'miskin', 'cuma', 'stok', '']"
335,Sikap WHO Vaksin Covid-19 Pertama dengan Kedua Beda Merek,cnbcindonesia,0,sikap who vaksin covid pertama dengan kedua beda merek,"['sikap', 'who', 'vaksin', 'covid', 'pertama', 'dengan', 'kedua', 'beda', 'merek']","['sikap', 'who', 'pertama', 'kedua', 'beda', 'merek']","['sikap', 'who', 'pertama', 'dua', 'beda', 'merek']"
336,"Pasokan Seret, Ini 4 Strategi Menkes Amankan Vaksin Covid RI",cnbcindonesia,0,pasokan seret ini strategi menkes amankan vaksin covid ri,"['pasokan', 'seret', 'ini', 'strategi', 'menkes', 'amankan', 'vaksin', 'covid', 'ri']","['pasokan', 'seret', 'strategi', 'menkes', 'amankan', 'ri']","['pasok', 'seret', 'strategi', 'menkes', 'aman', 'ri']"
337,BPOM Beberkan Kabar Terbaru Vaksin Made in RI,cnbcindonesia,0,bpom beberkan kabar terbaru vaksin made in ri,"['bpom', 'beberkan', 'kabar', 'terbaru', 'vaksin', 'made', 'in', 'ri']","['bpom', 'beberkan', 'kabar', 'terbaru', 'made', 'in', 'ri']","['bpom', 'kan', 'kabar', 'baru', 'made', 'in', 'ri']"
338,"BPOM Bicara Soal Vaksin Nusantara Terawan, Apa Katanya?",cnbcindonesia,0,bpom bicara soal vaksin nusantara terawan apa katanya,"['bpom', 'bicara', 'soal', 'vaksin', 'nusantara', 'terawan', 'apa', 'katanya']","['bpom', 'bicara', 'soal', 'nusantara', 'terawan', 'apa', 'katanya']","['bpom', 'bicara', 'soal', 'nusantara', 'awan', 'apa', 'kata']"
339,Menkes Ungkap Alasan Terjadinya Rebutan Vaksin Covid-19,cnbcindonesia,0,menkes ungkap alasan terjadinya rebutan vaksin covid,"['menkes', 'ungkap', 'alasan', 'terjadinya', 'rebutan', 'vaksin', 'covid']","['menkes', 'ungkap', 'alasan', 'terjadinya', 'rebutan', '']","['menkes', 'ungkap', 'alas', 'jadi', 'rebut', '']"
340,"Vaksin AstraZeneca Penuh Kontroversi, Ini Jalan Keluar Ahli",cnbcindonesia,-1,vaksin astrazeneca penuh kontroversi ini jalan keluar ahli,"['vaksin', 'astrazeneca', 'penuh', 'kontroversi', 'ini', 'jalan', 'keluar', 'ahli']","['', 'astrazeneca', 'penuh', 'kontroversi', 'jalan', 'keluar', 'ahli']","['', 'astrazeneca', 'penuh', 'kontroversi', 'jalan', 'keluar', 'ahli']"
341,"Netizen Heboh, Jepang Ingin Prioritaskan Vaksin untuk Atlet",cnbcindonesia,0,netizen heboh jepang ingin prioritaskan vaksin untuk atlet,"['netizen', 'heboh', 'jepang', 'ingin', 'prioritaskan', 'vaksin', 'untuk', 'atlet']","['netizen', 'heboh', 'jepang', 'prioritaskan', 'atlet']","['netizen', 'heboh', 'jepang', 'prioritas', 'atlet']"
342,"Grab Gelontorkan Rp 3,9 T untuk GrabForGood",cnbcindonesia,0,grab gelontorkan rp  untuk grabforgood,"['grab', 'gelontorkan', 'rp', 'untuk', 'grabforgood']","['grab', 'gelontorkan', 'rp', 'grabforgood']","['grab', 'gelontor', 'rp', 'grabforgood']"
343,"Pulihkan Ekonomi, Shopee Hadirkan Pusat Vaksinasi di Bandung",cnbcindonesia,1,pulihkan ekonomi shopee hadirkan pusat vaksinasi di bandung,"['pulihkan', 'ekonomi', 'shopee', 'hadirkan', 'pusat', 'vaksinasi', 'di', 'bandung']","['pulihkan', 'ekonomi', 'shopee', 'hadirkan', 'pusat', 'bandung']","['pulih', 'ekonomi', 'shopee', 'hadir', 'pusat', 'bandung']"
344,Dikorting! RI Cuma Dapat 20 Juta Vaksin AstraZeneca Tahun Ini,cnbcindonesia,0,dikorting ri cuma dapat juta vaksin astrazeneca tahun ini,"['dikorting', 'ri', 'cuma', 'dapat', 'juta', 'vaksin', 'astrazeneca', 'tahun', 'ini']","['dikorting', 'ri', 'cuma', 'juta', 'astrazeneca', 'tahun', '']","['korting', 'ri', 'cuma', 'juta', 'astrazeneca', 'tahun', '']"
345,Vaksinasi Covid-19 di Bali Terancam Terlambat 2 Bulan,cnbcindonesia,-1,vaksinasi covid di bali terancam terlambat bulan,"['vaksinasi', 'covid', 'di', 'bali', 'terancam', 'terlambat', 'bulan']","['', 'bali', 'terancam', 'terlambat', 'bulan']","['', 'bal', 'ancam', 'lambat', 'bulan']"
346,"Menkes Akui Laju Vaksinasi Covid Melambat, Ini Biang Keroknya",cnbcindonesia,-1,menkes akui laju vaksinasi covid melambat ini biang keroknya,"['menkes', 'akui', 'laju', 'vaksinasi', 'covid', 'melambat', 'ini', 'biang', 'keroknya']","['menkes', 'akui', 'laju', 'melambat', 'biang', 'keroknya']","['menkes', 'aku', 'laju', 'lambat', 'biang', 'kerok']"
347,Menkes Pamer RI Peringkat 8 Jawara Vaksinasi Covid Dunia,cnbcindonesia,1,menkes pamer ri peringkat jawara vaksinasi covid dunia,"['menkes', 'pamer', 'ri', 'peringkat', 'jawara', 'vaksinasi', 'covid', 'dunia']","['menkes', 'pamer', 'ri', 'peringkat', 'jawara', 'dunia']","['menkes', 'pamer', 'ri', 'peringkat', 'jawara', 'dunia']"
348,"Simak, Ini Kabar Terbaru Vaksinasi AstraZeneca di Inggris",cnbcindonesia,0,simak ini kabar terbaru vaksinasi astrazeneca di inggris,"['simak', 'ini', 'kabar', 'terbaru', 'vaksinasi', 'astrazeneca', 'di', 'inggris']","['simak', 'kabar', 'terbaru', 'astrazeneca', 'inggris']","['simak', 'kabar', 'baru', 'astrazeneca', 'inggris']"
349,"Di Spanyol, Vaksin Covid-19 AstraZeneca Cuma Buat Lansia",cnbcindonesia,0,di spanyol vaksin covid astrazeneca cuma buat lansia,"['di', 'spanyol', 'vaksin', 'covid', 'astrazeneca', 'cuma', 'buat', 'lansia']","['', 'spanyol', 'astrazeneca', 'cuma', 'buat', 'lansia']","['', 'spanyol', 'astrazeneca', 'cuma', 'buat', 'lansia']"
350,"Pembekuan Darah Ramai Lagi, Ini Sikap WHO ke AstraZeneca",cnbcindonesia,-1,pembekuan darah ramai lagi ini sikap who ke astrazeneca,"['pembekuan', 'darah', 'ramai', 'lagi', 'ini', 'sikap', 'who', 'ke', 'astrazeneca']","['pembekuan', 'darah', 'ramai', 'sikap', 'who', 'astrazeneca']","['beku', 'darah', 'ramai', 'sikap', 'who', 'astrazeneca']"
351,Studi Chile: Suntikan Pertama Sinovac Tak Lindungi dari Covid,cnbcindonesia,-1,studi chile suntikan pertama sinovac tak lindungi dari covid,"['studi', 'chile', 'suntikan', 'pertama', 'sinovac', 'tak', 'lindungi', 'dari', 'covid']","['studi', 'chile', 'suntikan', 'pertama', 'sinovac', 'tak', 'lindungi', '']","['studi', 'chile', 'sunti', 'pertama', 'sinovac', 'tak', 'lindung', '']"
352,Ahli Ini Kaitkan Vaksin AstraZeneca dengan Pembekuan Darah,cnbcindonesia,-1,ahli ini kaitkan vaksin astrazeneca dengan pembekuan darah,"['ahli', 'ini', 'kaitkan', 'vaksin', 'astrazeneca', 'dengan', 'pembekuan', 'darah']","['ahli', 'kaitkan', 'astrazeneca', 'pembekuan', 'darah']","['ahli', 'kait', 'astrazeneca', 'beku', 'darah']"
353,Awas Ribut! UE Blokir Ekspor Vaksin Covid ke Australia,cnbcindonesia,0,awas ribut ue blokir ekspor vaksin covid ke australia,"['awas', 'ribut', 'ue', 'blokir', 'ekspor', 'vaksin', 'covid', 'ke', 'australia']","['awas', 'ribut', 'ue', 'blokir', 'ekspor', 'australia']","['awas', 'ribut', 'ue', 'blokir', 'ekspor', 'australia']"
354,"India Embargo Vaksin, RI Kehilangan 10 Juta Vaksin Gratis",cnbcindonesia,-1,india embargo vaksin ri kehilangan juta vaksin gratis,"['india', 'embargo', 'vaksin', 'ri', 'kehilangan', 'juta', 'vaksin', 'gratis']","['india', 'embargo', 'ri', 'kehilangan', 'juta', 'gratis']","['india', 'embargo', 'ri', 'hilang', 'juta', 'gratis']"
355,Syarat Baru Perjalanan RI & Masa Berlaku PCR-Antigen-GeNose,cnbcindonesia,0,syarat baru perjalanan ri masa berlaku pcrantigengenose,"['syarat', 'baru', 'perjalanan', 'ri', 'masa', 'berlaku', 'pcrantigengenose']","['syarat', 'baru', 'perjalanan', 'ri', 'masa', 'berlaku', 'pcrantigengenose']","['syarat', 'baru', 'jalan', 'ri', 'masa', 'laku', 'pcrantigengenose']"
356,"AS Stop Produksi Vaksin AstraZeneca, Ini Kata Penasihat Biden",cnbcindonesia,0,as stop produksi vaksin astrazeneca ini kata penasihat biden,"['as', 'stop', 'produksi', 'vaksin', 'astrazeneca', 'ini', 'kata', 'penasihat', 'biden']","['as', 'stop', 'produksi', 'astrazeneca', 'kata', 'penasihat', 'biden']","['as', 'stop', 'produksi', 'astrazeneca', 'kata', 'nasihat', 'biden']"
357,Dapat Pesan Vaksin Covid Ini? Jangan Dibalas atau Dirampok!,cnbcindonesia,0,dapat pesan vaksin covid ini jangan dibalas atau dirampok,"['dapat', 'pesan', 'vaksin', 'covid', 'ini', 'jangan', 'dibalas', 'atau', 'dirampok']","['', 'pesan', 'jangan', 'dibalas', 'dirampok']","['', 'pesan', 'jangan', 'balas', 'rampok']"
358,Berapa Lama Vaksin Covid-19 Lindungi Tubuh dari Virus Corona?,cnbcindonesia,0,berapa lama vaksin covid lindungi tubuh dari virus corona,"['berapa', 'lama', 'vaksin', 'covid', 'lindungi', 'tubuh', 'dari', 'virus', 'corona']","['berapa', 'lama', 'lindungi', 'tubuh', 'virus', '']","['berapa', 'lama', 'lindung', 'tubuh', 'virus', '']"
359,"AS 'Buang' AstraZeneca, Ganti Pakai Vaksin Corona Ini",cnbcindonesia,0,as buang astrazeneca ganti pakai vaksin corona ini,"['as', 'buang', 'astrazeneca', 'ganti', 'pakai', 'vaksin', 'corona', 'ini']","['as', 'buang', 'astrazeneca', 'ganti', 'pakai', '']","['as', 'buang', 'astrazeneca', 'ganti', 'pakai', '']"
360,"30 Orang Sakit Serius Usai Divaksin AstraZeneca, 7 Tewas",cnbcindonesia,-1,orang sakit serius usai divaksin astrazeneca tewas,"['orang', 'sakit', 'serius', 'usai', 'divaksin', 'astrazeneca', 'tewas']","['orang', 'sakit', 'serius', 'usai', 'astrazeneca', 'tewas']","['orang', 'sakit', 'serius', 'usai', 'astrazeneca', 'tewas']"
361,"Usai Disuntik Vaksin Sputnik, Presiden Ini Positif Covid-19",cnbcindonesia,-1,usai disuntik vaksin sputnik presiden ini positif covid,"['usai', 'disuntik', 'vaksin', 'sputnik', 'presiden', 'ini', 'positif', 'covid']","['usai', 'disuntik', 'sputnik', 'presiden', 'positif', '']","['usai', 'suntik', 'sputnik', 'presiden', 'positif', '']"
362,Vaksinasi Ampuh Pulihkan Pasien Long Covid? Cek Faktanya,cnbcindonesia,0,vaksinasi ampuh pulihkan pasien long covid cek faktanya,"['vaksinasi', 'ampuh', 'pulihkan', 'pasien', 'long', 'covid', 'cek', 'faktanya']","['', 'ampuh', 'pulihkan', 'pasien', 'long', 'cek', 'faktanya']","['', 'ampuh', 'pulih', 'pasien', 'long', 'cek', 'fakta']"
363,"Duh, 30 Orang Alami Pembekuan Darah Usai Divaksin Astrazeneca",cnbcindonesia,-1,duh orang alami pembekuan darah usai divaksin astrazeneca,"['duh', 'orang', 'alami', 'pembekuan', 'darah', 'usai', 'divaksin', 'astrazeneca']","['duh', 'orang', 'alami', 'pembekuan', 'darah', 'usai', 'astrazeneca']","['duh', 'orang', 'alami', 'beku', 'darah', 'usai', 'astrazeneca']"
364,"5 Negara Ini Tangguhkan AstraZeneca untuk Non Lansia, RI?",cnbcindonesia,0,negara ini tangguhkan astrazeneca untuk non lansia ri,"['negara', 'ini', 'tangguhkan', 'astrazeneca', 'untuk', 'non', 'lansia', 'ri']","['negara', 'tangguhkan', 'astrazeneca', 'non', 'lansia', 'ri']","['negara', 'tangguh', 'astrazeneca', 'non', 'lansia', 'ri']"
365,"Duh! Kasus Covid India Terus Meroket, Pasokan Vaksin Terancam",cnbcindonesia,-1,duh kasus covid india terus meroket pasokan vaksin terancam,"['duh', 'kasus', 'covid', 'india', 'terus', 'meroket', 'pasokan', 'vaksin', 'terancam']","['duh', 'kasus', 'india', 'terus', 'meroket', 'pasokan', 'terancam']","['duh', 'kasus', 'india', 'terus', 'roket', 'pasok', 'ancam']"
366,Gokil! Vaksin Corona Ini Ampuh 100% Lawan Covid Afsel,cnbcindonesia,1,gokil vaksin corona ini ampuh lawan covid afsel,"['gokil', 'vaksin', 'corona', 'ini', 'ampuh', 'lawan', 'covid', 'afsel']","['gokil', 'ampuh', 'lawan', 'afsel']","['gokil', 'ampuh', 'lawan', 'afsel']"
367,Inggris Laporkan 30 Kasus Pembekuan Darah Vaksin AstraZeneca,cnbcindonesia,-1,inggris laporkan kasus pembekuan darah vaksin astrazeneca,"['inggris', 'laporkan', 'kasus', 'pembekuan', 'darah', 'vaksin', 'astrazeneca']","['inggris', 'laporkan', 'kasus', 'pembekuan', 'darah', 'astrazeneca']","['inggris', 'lapor', 'kasus', 'beku', 'darah', 'astrazeneca']"
368,Top Pfizer! Vaksin Covid 100% Manjur Lawan Varian Afsel,cnbcindonesia,1,top pfizer vaksin covid manjur lawan varian afsel,"['top', 'pfizer', 'vaksin', 'covid', 'manjur', 'lawan', 'varian', 'afsel']","['top', 'pfizer', 'manjur', 'lawan', 'varian', 'afsel']","['top', 'pfizer', 'manjur', 'lawan', 'varian', 'afsel']"
369,Presiden Jerman Disuntik Vaksin Covid-19 AstraZeneca,cnbcindonesia,0,presiden jerman disuntik vaksin covid astrazeneca,"['presiden', 'jerman', 'disuntik', 'vaksin', 'covid', 'astrazeneca']","['presiden', 'jerman', 'disuntik', 'astrazeneca']","['presiden', 'jerman', 'suntik', 'astrazeneca']"
370,Nah Lho! Brasil Tolak Vaksin Covid-19 India,cnbcindonesia,0,nah lho brasil tolak vaksin covid india,"['nah', 'lho', 'brasil', 'tolak', 'vaksin', 'covid', 'india']","['nah', 'lho', 'brasil', 'tolak', 'india']","['nah', 'lho', 'brasil', 'tolak', 'india']"
371,"Vaksinasi Covid-19 RI Tahap 3 Mulai Juni, Molor?",cnbcindonesia,0,vaksinasi covid ri tahap mulai juni molor,"['vaksinasi', 'covid', 'ri', 'tahap', 'mulai', 'juni', 'molor']","['', 'ri', 'tahap', 'mulai', 'juni', 'molor']","['', 'ri', 'tahap', 'mulai', 'juni', 'molor']"
372,"Vaksin AstraZeneca Dilarang Digunakan di Kanada, Kenapa?",cnbcindonesia,0,vaksin astrazeneca dilarang digunakan di kanada kenapa,"['vaksin', 'astrazeneca', 'dilarang', 'digunakan', 'di', 'kanada', 'kenapa']","['', 'astrazeneca', 'dilarang', 'digunakan', 'kanada', '']","['', 'astrazeneca', 'larang', 'guna', 'kanada', '']"
373,WHO Bicara Profil Risiko 'Membebani' Vaksin AstraZeneca,cnbcindonesia,0,who bicara profil risiko membebani vaksin astrazeneca,"['who', 'bicara', 'profil', 'risiko', 'membebani', 'vaksin', 'astrazeneca']","['who', 'bicara', 'profil', 'risiko', 'membebani', 'astrazeneca']","['who', 'bicara', 'profil', 'risiko', 'beban', 'astrazeneca']"
374,Riset Baru: Vaksin Pfizer Ampuh 100% Lawan Covid di Remaja,cnbcindonesia,1,riset baru vaksin pfizer ampuh lawan covid di remaja,"['riset', 'baru', 'vaksin', 'pfizer', 'ampuh', 'lawan', 'covid', 'di', 'remaja']","['riset', 'baru', 'pfizer', 'ampuh', 'lawan', 'remaja']","['riset', 'baru', 'pfizer', 'ampuh', 'lawan', 'remaja']"
